queryIndex,queryItem,stringId,ncbiTaxonId,taxonName,preferredName,annotation,uniprot_accession
727,ENSP00000171757,9606.ENSP00000171757,9606,Homo sapiens,P2RY10,Putative P2Y purinoceptor 10; Putative receptor for purines coupled to G-proteins.,O00398
728,ENSP00000218721,9606.ENSP00000218721,9606,Homo sapiens,MLNR,Motilin receptor; Receptor for motilin; Belongs to the G-protein coupled receptor 1 family.,O43193
729,ENSP00000217270,9606.ENSP00000217270,9606,Homo sapiens,PROKR2,"Prokineticin receptor 2; Receptor for prokineticin 2. Exclusively coupled to the G(q) subclass of heteromeric G proteins. Activation leads to mobilization of calcium, stimulation of phosphoinositide turnover and activation of p44/p42 mitogen-activated protein kinase.",Q8NFJ6
730,ENSP00000217386,9606.ENSP00000217386,9606,Homo sapiens,OXT,Oxytocin-neurophysin 1; Neurophysin 1 specifically binds oxytocin.,P01178
731,ENSP00000226413,9606.ENSP00000226413,9606,Homo sapiens,GNRHR,Gonadotropin-releasing hormone receptor; Receptor for gonadotropin releasing hormone (GnRH) that mediates the action of GnRH to stimulate the secretion of the gonadotropic hormones luteinizing hormone (LH) and follicle-stimulating hormone (FSH). This receptor mediates its action by association with G- proteins that activate a phosphatidylinositol-calcium second messenger system. Isoform 2 may act as an inhibitor of GnRH-R signaling.,P30968
732,ENSP00000241256,9606.ENSP00000241256,9606,Homo sapiens,GHSR,"Growth hormone secretagogue receptor type 1; Receptor for ghrelin, coupled to G-alpha-11 proteins. Stimulates growth hormone secretion. Binds also other growth hormone releasing peptides (GHRP) (e.g. Met-enkephalin and GHRP-6) as well as non-peptide, low molecular weight secretagogues (e.g. L-692,429, MK- 0677, adenosine).",Q92847
733,ENSP00000234371,9606.ENSP00000234371,9606,Homo sapiens,KISS1R,"KiSS-1 receptor; Receptor for metastin (kisspeptin-54 or kp-54), a C- terminally amidated peptide of KiSS1. KiSS1 is a metastasis suppressor protein that suppresses metastases in malignant melanomas and in some breast carcinomas without affecting tumorigenicity. The metastasis suppressor properties may be mediated in part by cell cycle arrest and induction of apoptosis in malignant cells. The receptor is essential for normal gonadotropin-released hormone physiology and for puberty. The hypothalamic KiSS1/KISS1R system is a pivotal factor in central regulation of the gonadotropic axis a [...] ",Q969F8
734,ENSP00000246549,9606.ENSP00000473159,9606,Homo sapiens,FFAR2,"Free fatty acid receptor 2; G protein-coupled receptor that is activated by a major product of dietary fiber digestion, the short chain fatty acids (SCFAs), and that plays a role in the regulation of whole-body energy homeostasis and in intestinal immunity. In omnivorous mammals, the short chain fatty acids acetate, propionate and butyrate are produced primarily by the gut microbiome that metabolizes dietary fibers. SCFAs serve as a source of energy but also act as signaling molecules. That G protein-coupled receptor is probably coupled to the pertussis toxin- sensitive, G(i/o)-alpha f [...] ",O15552
735,ENSP00000245983,9606.ENSP00000245983,9606,Homo sapiens,GNRH2,GnRH-associated peptide 2; Stimulates the secretion of gonadotropins; it stimulates the secretion of both luteinizing and follicle-stimulating hormones; Belongs to the GnRH family.,O43555
736,ENSP00000246553,9606.ENSP00000246553,9606,Homo sapiens,FFAR1,"Free fatty acid receptor 1; G-protein coupled receptor for medium and long chain saturated and unsaturated fatty acids that plays an important role in glucose homeostasis. Fatty acid binding increases glucose-stimulated insulin secretion, and may also enhance the secretion of glucagon-like peptide 1 (GLP-1). May also play a role in bone homeostasis; receptor signaling activates pathways that inhibit osteoclast differentiation (By similarity). Ligand binding leads to a conformation change that triggers signaling via G-proteins that activate phospholipase C, leading to an increase of the [...] ",O14842
737,ENSP00000256010,9606.ENSP00000256010,9606,Homo sapiens,NTS,Neurotensin/neuromedin N; Neurotensin may play an endocrine or paracrine role in the regulation of fat metabolism. It causes contraction of smooth muscle; Belongs to the neurotensin family.,P30990
738,ENSP00000255380,9606.ENSP00000255380,9606,Homo sapiens,CHRM3,"Muscarinic acetylcholine receptor M3; The muscarinic acetylcholine receptor mediates various cellular responses, including inhibition of adenylate cyclase, breakdown of phosphoinositides and modulation of potassium channels through the action of G proteins. Primary transducing effect is Pi turnover.",P20309
739,ENSP00000256857,9606.ENSP00000256857,9606,Homo sapiens,GRP,"Gastrin-releasing peptide; Stimulates the release of gastrin and other gastrointestinal hormones (By similarity). Contributes to the perception of prurient stimuli and to the transmission of itch signals in the spinal cord that promote scratching behavior. Contributes primarily to nonhistaminergic itch sensation. Contributes to long-term fear memory, but not normal spatial memory. Contributes to the regulation of food intake (By similarity).",P07492
740,ENSP00000258042,9606.ENSP00000258042,9606,Homo sapiens,NMBR,Neuromedin-B receptor; Receptor for neuromedin-B.,P28336
741,ENSP00000258400,9606.ENSP00000258400,9606,Homo sapiens,HTR2B,5-hydroxytryptamine receptor 2B; G-protein coupled receptor for 5-hydroxytryptamine (serotonin). Also functions as a receptor for various ergot alkaloid derivatives and psychoactive substances. Ligand binding causes a conformation change that triggers signaling via guanine nucleotide-binding proteins (G proteins) and modulates the activity of down-stream effectors. Beta-arrestin family members inhibit signaling via G proteins and mediate activation of alternative signaling pathways. Signaling activates a phosphatidylinositol-calcium second messenger system that modulates the activity o [...] ,P41595
742,ENSP00000215941,9606.ENSP00000215941,9606,Homo sapiens,ANKRD54,Ankyrin repeat domain-containing protein 54; Plays an important role in regulating intracellular signaling events associated with erythroid terminal differentiation.,Q6NXT1
743,ENSP00000164227,9606.ENSP00000164227,9606,Homo sapiens,BCL3,"B-cell lymphoma 3 protein; Contributes to the regulation of transcriptional activation of NF-kappa-B target genes. In the cytoplasm, inhibits the nuclear translocation of the NF-kappa-B p50 subunit. In the nucleus, acts as transcriptional activator that promotes transcription of NF-kappa-B target genes. Contributes to the regulation of cell proliferation (By similarity).",P20749
744,ENSP00000170168,9606.ENSP00000170168,9606,Homo sapiens,REXO1,RNA exonuclease 1 homolog; Seems to have no detectable effect on transcription elongation in vitro; Belongs to the REXO1/REXO3 family.,Q8N1G1
745,ENSP00000224950,9606.ENSP00000224950,9606,Homo sapiens,STN1,"CST complex subunit STN1; Component of the CST complex proposed to act as a specialized replication factor promoting DNA replication under conditions of replication stress or natural replication barriers such as the telomere duplex. The CST complex binds single-stranded DNA with high affinity in a sequence-independent manner, while isolated subunits bind DNA with low affinity by themselves. Initially the CST complex has been proposed to protect telomeres from DNA degradation. However, the CST complex has been shown to be involved in several aspects of telomere replication. The CST comp [...] ",Q9H668
746,ENSP00000228843,9606.ENSP00000228843,9606,Homo sapiens,RAD51AP1,"RAD51-associated protein 1; May participate in a common DNA damage response pathway associated with the activation of homologous recombination and double- strand break repair. Functionally cooperates with PALB2 in promoting of D-loop formation by RAD51. Binds to single and double stranded DNA, and is capable of aggregating DNA. Also binds RNA.",Q96B01
747,ENSP00000258428,9606.ENSP00000258428,9606,Homo sapiens,REV1,DNA repair protein REV1; Deoxycytidyl transferase involved in DNA repair. Transfers a dCMP residue from dCTP to the 3'-end of a DNA primer in a template- dependent reaction. May assist in the first step in the bypass of abasic lesions by the insertion of a nucleotide opposite the lesion. Required for normal induction of mutations by physical and chemical agents.,Q9UBZ9
748,ENSP00000261368,9606.ENSP00000261367,9606,Homo sapiens,SNCAIP,"Synphilin-1; Isoform 2 inhibits the ubiquitin ligase activity of SIAH1 and inhibits proteasomal degradation of target proteins. Isoform 2 inhibits autoubiquitination and proteasomal degradation of SIAH1, and thereby increases cellular levels of SIAH. Isoform 2 modulates SNCA monoubiquitination by SIAH1.",Q9Y6H5
749,ENSP00000261377,9606.ENSP00000261377,9606,Homo sapiens,REXO5,RNA exonuclease 5.,Q96IC2
750,ENSP00000261881,9606.ENSP00000261881,9606,Homo sapiens,TIPIN,"TIMELESS-interacting protein; Plays an important role in the control of DNA replication and the maintenance of replication fork stability. Important for cell survival after DNA damage or replication stress. May be specifically required for the ATR-CHEK1 pathway in the replication checkpoint induced by hydroxyurea or ultraviolet light. Forms a complex with TIMELESS and this complex regulates DNA replication processes under both normal and stress conditions, stabilizes replication forks and influences both CHEK1 phosphorylation and the intra-S phase checkpoint in response to genotoxic st [...] ",Q9BVW5
751,ENSP00000261584,9606.ENSP00000261584,9606,Homo sapiens,PALB2,"Partner and localizer of BRCA2; Plays a critical role in homologous recombination repair (HRR) through its ability to recruit BRCA2 and RAD51 to DNA breaks. Strongly stimulates the DNA strand- invasion activity of RAD51, stabilizes the nucleoprotein filament against a disruptive BRC3-BRC4 polypeptide and helps RAD51 to overcome the suppressive effect of replication protein A (RPA). Functionally cooperates with RAD51AP1 in promoting of D-loop formation by RAD51. Serves as the molecular scaffold in the formation of the BRCA1-PALB2-BRCA2 complex which is essential for homologous recombina [...] ",Q86YC2
752,ENSP00000262315,9606.ENSP00000262315,9606,Homo sapiens,CHTF18,"Chromosome transmission fidelity protein 18 homolog; Chromosome cohesion factor involved in sister chromatid cohesion and fidelity of chromosome transmission. Component of one of the cell nuclear antigen loader complexes, CTF18-replication factor C (CTF18-RFC), which consists of CTF18, CTF8, DCC1, RFC2, RFC3, RFC4 and RFC5. The CTF18-RFC complex binds to single-stranded and primed DNAs and has weak ATPase activity that is stimulated by the presence of primed DNA, replication protein A (RPA) and by proliferating cell nuclear antigen (PCNA). The CTF18-RFC complex catalyzes the ATP- depen [...] ",Q8WVB6
753,ENSP00000055335,9606.ENSP00000055335,9606,Homo sapiens,PPP1R3F,Protein phosphatase 1 regulatory subunit 3F; Glycogen-targeting subunit for protein phosphatase 1 (PP1).,Q6ZSY5
754,ENSP00000238994,9606.ENSP00000238994,9606,Homo sapiens,PPP1R3C,"Protein phosphatase 1 regulatory subunit 3C; Acts as a glycogen-targeting subunit for PP1 and regulates its activity. Activates glycogen synthase, reduces glycogen phosphorylase activity and limits glycogen breakdown. Dramatically increases basal and insulin-stimulated glycogen synthesis upon overexpression in a variety of cell types.",Q9UQK1
755,ENSP00000056217,9606.ENSP00000056217,9606,Homo sapiens,ARHGEF5,"Rho guanine nucleotide exchange factor 5; Guanine nucleotide exchange factor which activates Rho GTPases. Strongly activates RHOA. Also strongly activates RHOB, weakly activates RHOC and RHOG and shows no effect on RHOD, RHOV, RHOQ or RAC1 (By similarity). Involved in regulation of cell shape and actin cytoskeletal organization. Plays a role in actin organization by generating a loss of actin stress fibers and the formation of membrane ruffles and filopodia. Required for SRC-induced podosome formation (By similarity). Involved in positive regulation of immature dendritic cell migration [...] ",Q12774
756,ENSP00000056233,9606.ENSP00000056233,9606,Homo sapiens,NFE2L3,"Nuclear factor erythroid 2-related factor 3; Activates erythroid-specific, globin gene expression.",Q9Y4A8
757,ENSP00000229416,9606.ENSP00000497574,9606,Homo sapiens,GCLC,Glutamate-cysteine ligase catalytic subunit.,NA
758,ENSP00000057513,9606.ENSP00000426613,9606,Homo sapiens,TNIP3,"TNFAIP3-interacting protein 3; Binds to zinc finger protein TNFAIP3 and inhibits NF-kappa-B activation induced by tumor necrosis factor, Toll-like receptor 4 (TLR4), interleukin-1 and 12-O-tetradecanoylphorbol-13-acetate. Overexpression inhibits NF-kappa-B-dependent gene expression in response to lipopolysaccharide at a level downstream of TRAF6 and upstream of IKBKB. NF-kappa-B inhibition is independent of TNFAIP3 binding.",Q96KP6
759,ENSP00000237289,9606.ENSP00000481570,9606,Homo sapiens,TNFAIP3,"Tumor necrosis factor alpha-induced protein 3; Ubiquitin-editing enzyme that contains both ubiquitin ligase and deubiquitinase activities. Involved in immune and inflammatory responses signaled by cytokines, such as TNF-alpha and IL-1 beta, or pathogens via Toll-like receptors (TLRs) through terminating NF-kappa-B activity. Essential component of a ubiquitin-editing protein complex, comprising also RNF11, ITCH and TAX1BP1, that ensures the transient nature of inflammatory signaling pathways. In cooperation with TAX1BP1 promotes disassembly of E2-E3 ubiquitin protein ligase complexes in [...] ",P21580
760,ENSP00000061240,9606.ENSP00000061240,9606,Homo sapiens,TLL1,"Tolloid-like protein 1; Protease which processes procollagen C-propeptides, such as chordin, pro-biglycan and pro-lysyl oxidase. Required for the embryonic development. Predominant protease, which in the development, influences dorsal-ventral patterning and skeletogenesis.",O43897
761,ENSP00000231004,9606.ENSP00000231004,9606,Homo sapiens,LOX,"Protein-lysine 6-oxidase, short form; Responsible for the post-translational oxidative deamination of peptidyl lysine residues in precursors to fibrous collagen and elastin. Regulator of Ras expression. May play a role in tumor suppression. Plays a role in the aortic wall architecture (By similarity); Belongs to the lysyl oxidase family.",P28300
762,ENSP00000261921,9606.ENSP00000261921,9606,Homo sapiens,LOXL1,Lysyl oxidase homolog 1; Active on elastin and collagen substrates.,Q08397
763,ENSP00000260702,9606.ENSP00000260702,9606,Homo sapiens,LOXL4,Lysyl oxidase homolog 4; May modulate the formation of a collagenous extracellular matrix.,Q96JB6
764,ENSP00000062104,9606.ENSP00000497164,9606,Homo sapiens,NNAT,"Neuronatin; May participate in the maintenance of segment identity in the hindbrain and pituitary development, and maturation or maintenance of the overall structure of the nervous system. May function as a regulatory subunit of ion channels.",NA
765,ENSP00000064724,9606.ENSP00000064724,9606,Homo sapiens,CLDN11,"Claudin-11; Plays a major role in tight junction-specific obliteration of the intercellular space, through calcium-independent cell-adhesion activity.",O75508
766,ENSP00000183605,9606.ENSP00000340939,9606,Homo sapiens,CLDN18,"Claudin-18; Plays a major role in tight junction-specific obliteration of the intercellular space, through calcium-independent cell-adhesion activity; Belongs to the claudin family.",P56856
767,ENSP00000194155,9606.ENSP00000194155,9606,Homo sapiens,PCDHB2,Protocadherin beta-2; Potential calcium-dependent cell-adhesion protein. May be involved in the establishment and maintenance of specific neuronal connections in the brain.,Q9Y5E7
768,ENSP00000194152,9606.ENSP00000194152,9606,Homo sapiens,PCDHB4,Protocadherin beta-4; Potential calcium-dependent cell-adhesion protein. May be involved in the establishment and maintenance of specific neuronal connections in the brain.,Q9Y5E5
769,ENSP00000261944,9606.ENSP00000424565,9606,Homo sapiens,CDHR2,"Cadherin-related family member 2; Intermicrovillar adhesion molecule that forms, via its extracellular domain, calcium-dependent heterophilic complexes with CDHR5 on adjacent microvilli. Thereby, controls the packing of microvilli at the apical membrane of epithelial cells. Through its cytoplasmic domain, interacts with microvillus cytoplasmic proteins to form the intermicrovillar adhesion complex/IMAC. This complex plays a central role in microvilli and epithelial brush border differentiation. May also play a role in cell-cell adhesion and contact inhibition in epithelial cells.",Q9BYE9
770,ENSP00000257189,9606.ENSP00000257189,9606,Homo sapiens,DSG3,Desmoglein-3; Component of intercellular desmosome junctions. Involved in the interaction of plaque proteins and intermediate filaments mediating cell-cell adhesion.,P32926
771,ENSP00000231137,9606.ENSP00000231137,9606,Homo sapiens,PCDHB7,Protocadherin beta-7; Potential calcium-dependent cell-adhesion protein. May be involved in the establishment and maintenance of specific neuronal connections in the brain.,Q9Y5E2
772,ENSP00000231134,9606.ENSP00000231134,9606,Homo sapiens,PCDHB5,Protocadherin beta-5; Potential calcium-dependent cell-adhesion protein. May be involved in the establishment and maintenance of specific neuronal connections in the brain.,Q9Y5E4
773,ENSP00000239449,9606.ENSP00000239449,9606,Homo sapiens,PCDHB14,Protocadherin beta-14; Potential calcium-dependent cell-adhesion protein. May be involved in the establishment and maintenance of specific neuronal connections in the brain.,Q9Y5E9
774,ENSP00000231130,9606.ENSP00000231130,9606,Homo sapiens,PCDHB3,Protocadherin beta-3; Potential calcium-dependent cell-adhesion protein. May be involved in the establishment and maintenance of specific neuronal connections in the brain.,Q9Y5E6
775,ENSP00000231136,9606.ENSP00000231136,9606,Homo sapiens,PCDHB6,"Protocadherin beta-6; Calcium-dependent cell-adhesion protein involved in cells self-recognition and non-self discrimination. Thereby, it is involved in the establishment and maintenance of specific neuronal connections in the brain.",Q9Y5E3
776,ENSP00000239444,9606.ENSP00000239444,9606,Homo sapiens,PCDHB8,"Protocadherin beta-8; Calcium-dependent cell-adhesion protein involved in cells self-recognition and non-self discrimination. Thereby, it is involved in the establishment and maintenance of specific neuronal connections in the brain.",Q9UN66
777,ENSP00000231173,9606.ENSP00000231173,9606,Homo sapiens,PCDHB15,Protocadherin beta-15; Potential calcium-dependent cell-adhesion protein. May be involved in the establishment and maintenance of specific neuronal connections in the brain.,Q9Y5E8
778,ENSP00000231484,9606.ENSP00000231484,9606,Homo sapiens,PCDH12,"Protocadherin-12, secreted form; Cellular adhesion molecule that may play an important role in cell-cell interactions at interendothelial junctions (By similarity). Acts as a regulator of cell migration, probably via increasing cell- cell adhesion. Promotes homotypic calcium-dependent aggregation and adhesion and clusters at intercellular junctions (By similarity). Unable to bind to catenins, weakly associates with the cytoskeleton (By similarity).",Q9NPG4
779,ENSP00000239446,9606.ENSP00000239446,9606,Homo sapiens,PCDHB10,Protocadherin beta-10; Potential calcium-dependent cell-adhesion protein. May be involved in the establishment and maintenance of specific neuronal connections in the brain.,Q9UN67
780,ENSP00000253812,9606.ENSP00000253812,9606,Homo sapiens,PCDHGA3,Protocadherin gamma-A3; Potential calcium-dependent cell-adhesion protein. May be involved in the establishment and maintenance of specific neuronal connections in the brain.,Q9Y5H0
781,ENSP00000252087,9606.ENSP00000252087,9606,Homo sapiens,PCDHGC5,Protocadherin gamma-C5; Potential calcium-dependent cell-adhesion protein. May be involved in the establishment and maintenance of specific neuronal connections in the brain.,Q9Y5F6
782,ENSP00000239450,9606.ENSP00000239450,9606,Homo sapiens,PCDHB12,Protocadherin beta-12; Potential calcium-dependent cell-adhesion protein. May be involved in the establishment and maintenance of specific neuronal connections in the brain.,Q9Y5F1
783,ENSP00000252085,9606.ENSP00000252085,9606,Homo sapiens,PCDHGA12,Protocadherin gamma-A12; Potential calcium-dependent cell-adhesion protein. May be involved in the establishment and maintenance of specific neuronal connections in the brain.,O60330
784,ENSP00000253807,9606.ENSP00000253807,9606,Homo sapiens,PCDHAC1,Protocadherin alpha-C1; Potential calcium-dependent cell-adhesion protein. May be involved in the establishment and maintenance of specific neuronal connections in the brain.,Q9H158
785,ENSP00000261590,9606.ENSP00000261590,9606,Homo sapiens,DSG2,Desmoglein-2; Component of intercellular desmosome junctions. Involved in the interaction of plaque proteins and intermediate filaments mediating cell-cell adhesion.,Q14126
786,ENSP00000257192,9606.ENSP00000257192,9606,Homo sapiens,DSG1,Desmoglein-1; Component of intercellular desmosome junctions. Involved in the interaction of plaque proteins and intermediate filaments mediating cell-cell adhesion.,Q02413
787,ENSP00000257198,9606.ENSP00000257198,9606,Homo sapiens,DSC1,Desmocollin-1; Component of intercellular desmosome junctions. Involved in the interaction of plaque proteins and intermediate filaments mediating cell-cell adhesion. May contribute to epidermal cell positioning (stratification) by mediating differential adhesiveness between cells that express different isoforms. Linked to the keratinization of epithelial tissues.,Q08554
788,ENSP00000262150,9606.ENSP00000262150,9606,Homo sapiens,CDH19,Cadherin-19; Cadherins are calcium-dependent cell adhesion proteins. They preferentially interact with themselves in a homophilic manner in connecting cells; cadherins may thus contribute to the sorting of heterogeneous cell types.,Q9H159
789,ENSP00000262160,9606.ENSP00000262160,9606,Homo sapiens,SMAD2,"Mothers against decapentaplegic homolog 2; Receptor-regulated SMAD (R-SMAD) that is an intracellular signal transducer and transcriptional modulator activated by TGF-beta (transforming growth factor) and activin type 1 receptor kinases. Binds the TRE element in the promoter region of many genes that are regulated by TGF-beta and, on formation of the SMAD2/SMAD4 complex, activates transcription. May act as a tumor suppressor in colorectal carcinoma. Positively regulates PDPK1 kinase activity by stimulating its dissociation from the 14-3-3 protein YWHAQ which acts as a negative regulator.",Q15796
790,ENSP00000075120,9606.ENSP00000075120,9606,Homo sapiens,SLC2A3,"Solute carrier family 2, facilitated glucose transporter member 3; Facilitative glucose transporter that can also mediate the uptake of various other monosaccharides across the cell membrane. Mediates the uptake of glucose, 2- deoxyglucose, galactose, mannose, xylose and fucose, and probably also dehydroascorbate. Does not mediate fructose transport. Belongs to the major facilitator superfamily. Sugar transporter (TC 2.A.1.1) family. Glucose transporter subfamily.",P11169
791,ENSP00000259915,9606.ENSP00000259915,9606,Homo sapiens,POU5F1,"POU domain, class 5, transcription factor 1; Transcription factor that binds to the octamer motif (5'- ATTTGCAT-3'). Forms a trimeric complex with SOX2 or SOX15 on DNA and controls the expression of a number of genes involved in embryonic development such as YES1, FGF4, UTF1 and ZFP206. Critical for early embryogenesis and for embryonic stem cell pluripotency. Belongs to the POU transcription factor family. Class-5 subfamily.",Q01860
792,ENSP00000204961,9606.ENSP00000204961,9606,Homo sapiens,EFNB1,"Ephrin-B1 intracellular domain; Cell surface transmembrane ligand for Eph receptors, a family of receptor tyrosine kinases which are crucial for migration, repulsion and adhesion during neuronal, vascular and epithelial development. Binding to Eph receptors residing on adjacent cells leads to contact-dependent bidirectional signaling into neighboring cells. Shows high affinity for the receptor tyrosine kinase EPHB1/ELK. Can also bind EPHB2 and EPHB3. Binds to, and induces collapse of, commissural axons/growth cones in vitro (By similarity). May play a role in constraining the orientati [...] ",P98172
793,ENSP00000215368,9606.ENSP00000215368,9606,Homo sapiens,EFNA2,"Ephrin-A2; Cell surface GPI-bound ligand for Eph receptors, a family of receptor tyrosine kinases which are crucial for migration, repulsion and adhesion during neuronal, vascular and epithelial development. Binds promiscuously Eph receptors residing on adjacent cells, leading to contact-dependent bidirectional signaling into neighboring cells. The signaling pathway downstream of the receptor is referred to as forward signaling while the signaling pathway downstream of the ephrin ligand is referred to as reverse signaling. With the EPHA2 receptor may play a role in bone remodeling thro [...] ",O43921
794,ENSP00000226091,9606.ENSP00000226091,9606,Homo sapiens,EFNB3,"Ephrin-B3; Cell surface transmembrane ligand for Eph receptors, a family of receptor tyrosine kinases which are crucial for migration, repulsion and adhesion during neuronal, vascular and epithelial development. Binds promiscuously Eph receptors residing on adjacent cells, leading to contact-dependent bidirectional signaling into neighboring cells. The signaling pathway downstream of the receptor is referred to as forward signaling while the signaling pathway downstream of the ephrin ligand is referred to as reverse signaling. May play a pivotal role in forebrain function. Binds to, an [...] ",Q15768
