queryIndex,queryItem,stringId,ncbiTaxonId,taxonName,preferredName,annotation,uniprot_accession
1141,ENSP00000223641,9606.ENSP00000223641,9606,Homo sapiens,SEC61B,Protein transport protein Sec61 subunit beta; Component of SEC61 channel-forming translocon complex that mediates transport of signal peptide-containing precursor polypeptides across endoplasmic reticulum (ER) (By similarity). Required for PKD1/Polycystin-1 biogenesis (By similarity).,P60468
1142,ENSP00000233025,9606.ENSP00000233025,9606,Homo sapiens,SPCS1,Signal peptidase complex subunit 1; Component of the microsomal signal peptidase complex which removes signal peptides from nascent proteins as they are translocated into the lumen of the endoplasmic reticulum. Belongs to the SPCS1 family.,Q9Y6A9
1143,ENSP00000244763,9606.ENSP00000244763,9606,Homo sapiens,SSR1,Translocon-associated protein subunit alpha; TRAP proteins are part of a complex whose function is to bind calcium to the ER membrane and thereby regulate the retention of ER resident proteins. May be involved in the recycling of the translocation apparatus after completion of the translocation process or may function as a membrane-bound chaperone facilitating folding of translocated proteins.,P43307
1144,ENSP00000254730,9606.ENSP00000254730,9606,Homo sapiens,EEFSEC,Selenocysteine-specific elongation factor; Translation factor necessary for the incorporation of selenocysteine into proteins. It probably replaces EF-Tu for the insertion of selenocysteine directed by the UGA codon. SelB binds GTP and GDP.,P57772
1145,ENSP00000258416,9606.ENSP00000258416,9606,Homo sapiens,EIF4E2,"Eukaryotic translation initiation factor 4E type 2; Recognizes and binds the 7-methylguanosine-containing mRNA cap during an early step in the initiation. Acts as a repressor of translation initiation. In contrast to EIF4E, it is unable to bind eIF4G (EIF4G1, EIF4G2 or EIF4G3), suggesting that it acts by competing with EIF4E and block assembly of eIF4F at the cap (By similarity).",O60573
1146,ENSP00000262213,9606.ENSP00000262213,9606,Homo sapiens,TRAM1,Translocating chain-associated membrane protein 1; Stimulatory or required for the translocation of secretory proteins across the ER membrane.,Q15629
1147,ENSP00000198767,9606.ENSP00000198767,9606,Homo sapiens,RRN3,"RNA polymerase I-specific transcription initiation factor RRN3; Required for efficient transcription initiation by RNA polymerase I. Required for the formation of the competent preinitiation complex (PIC). Dissociates from pol I as a consequence of transcription. In vitro, cannot activate transcription in a subsequent transcription reaction (By similarity).",Q9NYV6
1148,ENSP00000222567,9606.ENSP00000222567,9606,Homo sapiens,TWISTNB,DNA-directed RNA polymerase I subunit RPA43; DNA-dependent RNA polymerase catalyzes the transcription of DNA into RNA using the four ribonucleoside triphosphates as substrates. Component of RNA polymerase I which synthesizes ribosomal RNA precursors. Through its association with RRN3/TIF-IA may be involved in recruitment of Pol I to rDNA promoters; Belongs to the eukaryotic RPA43 RNA polymerase subunit family.,Q3B726
1149,ENSP00000198801,9606.ENSP00000198801,9606,Homo sapiens,MOGAT2,2-acylglycerol O-acyltransferase 2; Catalyzes the formation of diacylglycerol from 2- monoacylglycerol and fatty acyl-CoA. Has a preference toward monoacylglycerols containing unsaturated fatty acids in an order of C18:3 > C18:2 > C18:1 > C18:0. Plays a central role in absorption of dietary fat in the small intestine by catalyzing the resynthesis of triacylglycerol in enterocytes. May play a role in diet-induced obesity.,Q3SYC2
1150,ENSP00000223114,9606.ENSP00000223114,9606,Homo sapiens,MOGAT3,2-acylglycerol O-acyltransferase 3; Catalyzes the formation of diacylglycerol from 2- monoacylglycerol and fatty acyl-CoA. Also able to catalyze the terminal step in triacylglycerol synthesis by using diacylglycerol and fatty acyl-CoA as substrates. Has a preference toward palmitoyl-CoA and oleoyl-CoA. May be involved in absorption of dietary fat in the small intestine by catalyzing the resynthesis of triacylglycerol in enterocytes.,Q86VF5
1151,ENSP00000199280,9606.ENSP00000199280,9606,Homo sapiens,AQP2,"Aquaporin-2; Forms a water-specific channel that provides the plasma membranes of renal collecting duct with high permeability to water, thereby permitting water to move in the direction of an osmotic gradient. Plays an essential role in renal water homeostasis.",P41181
1152,ENSP00000199389,9606.ENSP00000199389,9606,Homo sapiens,EIF2AK1,"Eukaryotic translation initiation factor 2-alpha kinase 1; Inhibits protein synthesis at the translation initiation level, in response to various stress conditions, including oxidative stress, heme deficiency, osmotic shock and heat shock. Exerts its function through the phosphorylation of EIF2S1 at 'Ser-48' and 'Ser- 51', thus preventing its recycling. Binds hemin forming a 1:1 complex through a cysteine thiolate and histidine nitrogenous coordination. This binding occurs with moderate affinity, allowing it to sense the heme concentration within the cell. Thanks to this unique heme-se [...] ",Q9BQI3
1153,ENSP00000199447,9606.ENSP00000199447,9606,Homo sapiens,NME8,"Thioredoxin domain-containing protein 3; Probably required during the final stages of sperm tail maturation in the testis and/or epididymis, where extensive disulfide bonding of fibrous sheath (FS) proteins occurs. May be involved in the reduction of disulfide bonds within the sperm FS components. In vitro, it has neither NDP kinase nor reducing activity on disulfide bonds.",Q8N427
1154,ENSP00000216068,9606.ENSP00000216068,9606,Homo sapiens,DNAL4,"Dynein light chain 4, axonemal; Force generating protein of respiratory cilia. Produces force towards the minus ends of microtubules. Dynein has ATPase activity (By similarity).",O96015
1155,ENSP00000222250,9606.ENSP00000222250,9606,Homo sapiens,ARRDC2,Arrestin domain containing 2; Belongs to the arrestin family.,Q8TBH0
1156,ENSP00000216185,9606.ENSP00000216185,9606,Homo sapiens,TXN2,"Thioredoxin, mitochondrial; Important for the control of mitochondrial reactive oxygen species homeostasis, apoptosis regulation and cell viability. Possesses a dithiol-reducing activity; Belongs to the thioredoxin family.",Q99757
1157,ENSP00000221130,9606.ENSP00000221130,9606,Homo sapiens,GSR,"Glutathione reductase, mitochondrial; Maintains high levels of reduced glutathione in the cytosol.",P00390
1158,ENSP00000217515,9606.ENSP00000217515,9606,Homo sapiens,TXNL1,Thioredoxin-like protein 1; Active thioredoxin with a redox potential of about -250 mV.,O43396
1159,ENSP00000237858,9606.ENSP00000369314,9606,Homo sapiens,GLRX,Glutaredoxin-1; Has a glutathione-disulfide oxidoreductase activity in the presence of NADPH and glutathione reductase. Reduces low molecular weight disulfides and proteins; Belongs to the glutaredoxin family.,P35754
1160,ENSP00000242317,9606.ENSP00000480538,9606,Homo sapiens,DNAI1,"Dynein intermediate chain 1, axonemal; Part of the dynein complex of respiratory cilia; Belongs to the dynein intermediate chain family.",Q9UI46
1161,ENSP00000251810,9606.ENSP00000251810,9606,Homo sapiens,RRM2B,Ribonucleoside-diphosphate reductase subunit M2 B; Plays a pivotal role in cell survival by repairing damaged DNA in a p53/TP53-dependent manner. Supplies deoxyribonucleotides for DNA repair in cells arrested at G1 or G2. Contains an iron-tyrosyl free radical center required for catalysis. Forms an active ribonucleotide reductase (RNR) complex with RRM1 which is expressed both in resting and proliferating cells in response to DNA damage. Belongs to the ribonucleoside diphosphate reductase small chain family.,Q7LG56
1162,ENSP00000199708,9606.ENSP00000199708,9606,Homo sapiens,HBQ1,Hemoglobin subunit theta 1.,P09105
1163,ENSP00000250615,9606.ENSP00000250615,9606,Homo sapiens,AANAT,"Serotonin N-acetyltransferase; Controls the night/day rhythm of melatonin production in the pineal gland. Catalyzes the N-acetylation of serotonin into N- acetylserotonin, the penultimate step in the synthesis of melatonin. Belongs to the acetyltransferase family. AANAT subfamily.",Q16613
1164,ENSP00000251595,9606.ENSP00000251595,9606,Homo sapiens,HBA2,Hemoglobin subunit alpha; Involved in oxygen transport from the lung to the various peripheral tissues.,P69905
1165,ENSP00000252951,9606.ENSP00000252951,9606,Homo sapiens,HBZ,Hemoglobin subunit zeta; The zeta chain is an alpha-type chain of mammalian embryonic hemoglobin.,P02008
1166,ENSP00000199764,9606.ENSP00000199764,9606,Homo sapiens,CEACAM6,"Carcinoembryonic antigen-related cell adhesion molecule 6; Cell surface glycoprotein that plays a role in cell adhesion and tumor progression. Intercellular adhesion occurs in a calcium- and fibronectin-independent manner. Mediates homophilic and heterophilic cell adhesion with other carcinoembryonic antigen-related cell adhesion molecules, such as CEACAM5 and CEACAM8. Heterophilic interaction with CEACAM8 occurs in activated neutrophils. Plays a role in neutrophil adhesion to cytokine-activated endothelial cells. Plays a role as an oncogene by promoting tumor progression; positively r [...] ",P40199
1167,ENSP00000221992,9606.ENSP00000221992,9606,Homo sapiens,CEACAM5,"Carcinoembryonic antigen-related cell adhesion molecule 5; Cell surface glycoprotein that plays a role in cell adhesion, intracellular signaling and tumor progression. Mediates homophilic and heterophilic cell adhesion with other carcinoembryonic antigen-related cell adhesion molecules, such as CEACAM6. Plays a role as an oncogene by promoting tumor progression; induces resistance to anoikis of colorectal carcinoma cells. Belongs to the immunoglobulin superfamily. CEA family.",P06731
1168,ENSP00000225296,9606.ENSP00000225296,9606,Homo sapiens,DHX33,"ATP-dependent RNA helicase DHX33; Implicated in nucleolar organization, ribosome biogenesis, protein synthesis and cytoplasmic dsRNA sensing (By similarity). Stimulates RNA polymerase I transcription of the 47S precursor rRNA. Associates with ribosomal DNA (rDNA) loci where it is involved in POLR1A recruitment. In the cytoplasm, promotes elongation-competent 80S ribosome assembly at the late stage of mRNA translation initiation. Senses cytosolic dsRNA mediating NLRP3 inflammasome formation in macrophages and type I interferon production in myeloid dendritic cells. Required for NLRP3 ac [...] ",Q9H6R0
1169,ENSP00000251241,9606.ENSP00000251241,9606,Homo sapiens,DHX40,Probable ATP-dependent RNA helicase DHX40; Probable ATP-dependent RNA helicase; Belongs to the DEAD box helicase family. DEAH subfamily.,Q8IX18
1170,ENSP00000251636,9606.ENSP00000251636,9606,Homo sapiens,DHX29,ATP-dependent RNA helicase DHX29; ATP-binding RNA helicase involved in translation initiation. Part of the 43S pre-initiation complex that is required for efficient initiation on mRNAs of higher eukaryotes with structured 5'-UTRs by promoting efficient NTPase-dependent 48S complex formation. Specifically binds to the 40S ribosome near the mRNA entrance. Does not possess a processive helicase activity. Belongs to the DEAD box helicase family. DEAH subfamily.,Q7Z478
1171,ENSP00000199936,9606.ENSP00000199936,9606,Homo sapiens,HSD17B2,"Estradiol 17-beta-dehydrogenase 2; Capable of catalyzing the interconversion of testosterone and androstenedione, as well as estradiol and estrone. Also has 20-alpha- HSD activity. Uses NADH while EDH17B3 uses NADPH; Belongs to the short-chain dehydrogenases/reductases (SDR) family.",P37059
1172,ENSP00000254521,9606.ENSP00000254521,9606,Homo sapiens,HSD17B7,3-keto-steroid reductase; Responsible for the reduction of the keto group on the C-3 of sterols; Belongs to the short-chain dehydrogenases/reductases (SDR) family. ERG27 subfamily.,P56937
1173,ENSP00000256194,9606.ENSP00000256194,9606,Homo sapiens,MICAL2,"[F-actin]-monooxygenase MICAL2; Nuclear monooxygenase that promotes depolymerization of F- actin by mediating oxidation of specific methionine residues on actin to form methionine-sulfoxide, resulting in actin filament disassembly and preventing repolymerization. In the absence of actin, it also functions as a NADPH oxidase producing H(2)O(2) (By similarity). Acts as a key regulator of the SRF signaling pathway elicited by nerve growth factor and serum: mediates oxidation and subsequent depolymerization of nuclear actin, leading to increase MKL1/MRTF-A presence in the nucleus and promo [...] ",O94851
1174,ENSP00000215957,9606.ENSP00000215957,9606,Homo sapiens,MICALL1,"MICAL-like protein 1; Probable lipid-binding protein with higher affinity for phosphatidic acid, a lipid enriched in recycling endosome membranes. On endosome membranes, may act as a downstream effector of Rab proteins recruiting cytosolic proteins to regulate membrane tubulation. May be involved in a late step of receptor-mediated endocytosis regulating for instance endocytosed-EGF receptor trafficking. Alternatively, may regulate slow endocytic recycling of endocytosed proteins back to the plasma membrane. May indirectly play a role in neurite outgrowth.",Q8N3F8
1175,ENSP00000222693,9606.ENSP00000222693,9606,Homo sapiens,CAV2,"Caveolin-2; May act as a scaffolding protein within caveolar membranes. Interacts directly with G-protein alpha subunits and can functionally regulate their activity. Acts as an accessory protein in conjunction with CAV1 in targeting to lipid rafts and driving caveolae formation. The Ser-36 phosphorylated form has a role in modulating mitosis in endothelial cells. Positive regulator of cellular mitogenesis of the MAPK signaling pathway. Required for the insulin-stimulated nuclear translocation and activation of MAPK1 and STAT3, and the subsequent regulation of cell cycle progression (B [...] ",P51636
1176,ENSP00000261503,9606.ENSP00000261503,9606,Homo sapiens,SPECC1,Cytospin-B; Sperm antigen with calponin homology and coiled-coil domains 1.,Q5M775
1177,ENSP00000241261,9606.ENSP00000241261,9606,Homo sapiens,TNFSF10,"Tumor necrosis factor ligand superfamily member 10; Cytokine that binds to TNFRSF10A/TRAILR1, TNFRSF10B/TRAILR2, TNFRSF10C/TRAILR3, TNFRSF10D/TRAILR4 and possibly also to TNFRSF11B/OPG. Induces apoptosis. Its activity may be modulated by binding to the decoy receptors TNFRSF10C/TRAILR3, TNFRSF10D/TRAILR4 and TNFRSF11B/OPG that cannot induce apoptosis. Belongs to the tumor necrosis factor family.",P50591
1178,ENSP00000222823,9606.ENSP00000222823,9606,Homo sapiens,NOD1,Nucleotide-binding oligomerization domain-containing protein 1; Enhances caspase-9-mediated apoptosis. Induces NF-kappa-B activity via RIPK2 and IKK-gamma. Confers responsiveness to intracellular bacterial lipopolysaccharides (LPS). Forms an intracellular sensing system along with ARHGEF2 for the detection of microbial effectors during cell invasion by pathogens. Required for RHOA and RIPK2 dependent NF-kappa-B signaling pathway activation upon S.flexneri cell invasion. Involved not only in sensing peptidoglycan (PGN)-derived muropeptides but also in the activation of NF-kappa-B by Shi [...] ,Q9Y239
1179,ENSP00000200557,9606.ENSP00000200557,9606,Homo sapiens,ADAM11,Disintegrin and metalloproteinase domain-containing protein 11; Probable ligand for integrin in the brain. This is a non catalytic metalloprotease-like protein.,O75078
1180,ENSP00000200676,9606.ENSP00000200676,9606,Homo sapiens,CETP,"Cholesteryl ester transfer protein; Involved in the transfer of neutral lipids, including cholesteryl ester and triglyceride, among lipoprotein particles. Allows the net movement of cholesteryl ester from high density lipoproteins/HDL to triglyceride-rich very low density lipoproteins/VLDL, and the equimolar transport of triglyceride from VLDL to HDL. Regulates the reverse cholesterol transport, by which excess cholesterol is removed from peripheral tissues and returned to the liver for elimination ; Belongs to the BPI/LBP/Plunc superfamily. BPI/LBP family.",P11597
1181,ENSP00000236850,9606.ENSP00000236850,9606,Homo sapiens,APOA1,"Truncated apolipoprotein A-I; Participates in the reverse transport of cholesterol from tissues to the liver for excretion by promoting cholesterol efflux from tissues and by acting as a cofactor for the lecithin cholesterol acyltransferase (LCAT). As part of the SPAP complex, activates spermatozoa motility.",P02647
1182,ENSP00000201031,9606.ENSP00000201031,9606,Homo sapiens,TFAP2C,"Transcription factor AP-2 gamma; Sequence-specific DNA-binding protein that interacts with inducible viral and cellular enhancer elements to regulate transcription of selected genes. AP-2 factors bind to the consensus sequence 5'-GCCNNNGGC-3' and activate genes involved in a large spectrum of important biological functions including proper eye, face, body wall, limb and neural tube development. They also suppress a number of genes including MCAM/MUC18, C/EBP alpha and MYC. Involved in the MTA1-mediated epigenetic regulation of ESR1 expression in breast cancer.",Q92754
1183,ENSP00000250448,9606.ENSP00000250448,9606,Homo sapiens,FOXA1,"Hepatocyte nuclear factor 3-alpha; Transcription factor that is involved in embryonic development, establishment of tissue-specific gene expression and regulation of gene expression in differentiated tissues. Is thought to act as a 'pioneer' factor opening the compacted chromatin for other proteins through interactions with nucleosomal core histones and thereby replacing linker histones at target enhancer and/or promoter sites. Binds DNA with the consensus sequence 5'- [AC]A[AT]T[AG]TT[GT][AG][CT]T[CT]-3' (By similarity). Proposed to play a role in translating the epigenetic signatures [...] ",P55317
1184,ENSP00000239938,9606.ENSP00000239938,9606,Homo sapiens,EGR1,"Early growth response protein 1; Transcriptional regulator. Recognizes and binds to the DNA sequence 5'-GCG(T/G)GGGCG-3'(EGR-site) in the promoter region of target genes (By similarity). Binds double-stranded target DNA, irrespective of the cytosine methylation status. Regulates the transcription of numerous target genes, and thereby plays an important role in regulating the response to growth factors, DNA damage, and ischemia. Plays a role in the regulation of cell survival, proliferation and cell death. Activates expression of p53/TP53 and TGFB1, and thereby helps prevent tumor forma [...] ",P18146
1185,ENSP00000202017,9606.ENSP00000202017,9606,Homo sapiens,PDRG1,P53 and DNA damage-regulated protein 1; May play a role in chaperone-mediated protein folding.,Q9NUG6
1186,ENSP00000261813,9606.ENSP00000261813,9606,Homo sapiens,PFDN1,Prefoldin subunit 1; Binds specifically to cytosolic chaperonin (c-CPN) and transfers target proteins to it. Binds to nascent polypeptide chain and promotes folding in an environment in which there are many competing pathways for nonnative proteins.,O60925
1187,ENSP00000202556,9606.ENSP00000202556,9606,Homo sapiens,PPP1R13B,Apoptosis-stimulating of p53 protein 1; Regulator that plays a central role in regulation of apoptosis via its interaction with p53/TP53. Regulates TP53 by enhancing the DNA binding and transactivation function of TP53 on the promoters of proapoptotic genes in vivo.,Q96KQ4
1188,ENSP00000238721,9606.ENSP00000238721,9606,Homo sapiens,TP53I3,"Quinone oxidoreductase PIG3; May be involved in the generation of reactive oxygen species (ROS). Has low NADPH-dependent beta-naphthoquinone reductase activity, with a preference for 1,2-beta-naphthoquinone over 1,4-beta- naphthoquinone. Has low NADPH-dependent diamine reductase activity (in vitro).",Q53FA7
1189,ENSP00000258169,9606.ENSP00000258169,9606,Homo sapiens,MPHOSPH6,M-phase phosphoprotein 6; RNA-binding protein that associates with the RNA exosome complex. Involved in the 3'-processing of the 7S pre-RNA to the mature 5.8S rRNA and play a role in recruiting the RNA exosome complex to pre- rRNA; this function may include C1D.,Q99547
1190,ENSP00000226247,9606.ENSP00000226247,9606,Homo sapiens,FOXN1,"Forkhead box protein N1; Transcriptional regulator which regulates the development, differentiation, and function of thymic epithelial cells (TECs) both in the prenatal and postnatal thymus. Acts as a master regulator of the TECs lineage development and is required from the onset of differentiation in progenitor TECs in the developing fetus to the final differentiation steps through which TECs mature to acquire their full functionality. Regulates, either directly or indirectly the expression of a variety of genes that mediate diverse aspects of thymus development and function, includin [...] ",O15353
1191,ENSP00000229330,9606.ENSP00000229330,9606,Homo sapiens,HCFC2,Host cell factor C2.,Q9Y5Z7
1192,ENSP00000261302,9606.ENSP00000343288,9606,Homo sapiens,FOXN3,Forkhead box protein N3; Acts as a transcriptional repressor. May be involved in DNA damage-inducible cell cycle arrests (checkpoints).,O00409
1193,ENSP00000259806,9606.ENSP00000496415,9606,Homo sapiens,FOXF2,Forkhead box protein F2; Probable transcription activator for a number of lung- specific genes. Mediates up-regulation of the E3 ligase IRF2BPL and drives ubiquitination and degradation of CTNNB1.,NA
1194,ENSP00000258424,9606.ENSP00000258424,9606,Homo sapiens,COX5B,"Cytochrome c oxidase subunit 5B, mitochondrial; Component of the cytochrome c oxidase, the last enzyme in the mitochondrial electron transport chain which drives oxidative phosphorylation. The respiratory chain contains 3 multisubunit complexes succinate dehydrogenase (complex II, CII), ubiquinol- cytochrome c oxidoreductase (cytochrome b-c1 complex, complex III, CIII) and cytochrome c oxidase (complex IV, CIV), that cooperate to transfer electrons derived from NADH and succinate to molecular oxygen, creating an electrochemical gradient over the inner membrane that drives transmembrane [...] ",P10606
1195,ENSP00000203556,9606.ENSP00000203556,9606,Homo sapiens,GMIP,"GEM-interacting protein; Stimulates, in vitro and in vivo, the GTPase activity of RhoA.",Q9P107
1196,ENSP00000242480,9606.ENSP00000242480,9606,Homo sapiens,EGR2,E3 SUMO-protein ligase EGR2; Sequence-specific DNA-binding transcription factor. Binds to two specific DNA sites located in the promoter region of HOXA4. Belongs to the EGR C2H2-type zinc-finger protein family.,P11161
1197,ENSP00000204517,9606.ENSP00000204517,9606,Homo sapiens,TFAP4,Transcription factor AP-4; Transcription factor that activates both viral and cellular genes by binding to the symmetrical DNA sequence 5'-CAGCTG-3'.,Q01664
1198,ENSP00000204604,9606.ENSP00000204604,9606,Homo sapiens,CHRD,Chordin; Dorsalizing factor. Key developmental protein that dorsalizes early vertebrate embryonic tissues by binding to ventralizing TGF-beta family bone morphogenetic proteins (BMPs) and sequestering them in latent complexes (By similarity); Belongs to the chordin family.,Q9H2X0
1199,ENSP00000221496,9606.ENSP00000221496,9606,Homo sapiens,AMH,"Muellerian-inhibiting factor; This glycoprotein, produced by the Sertoli cells of the testis, causes regression of the Muellerian duct. It is also able to inhibit the growth of tumors derived from tissues of Muellerian duct origin.",P03971
1200,ENSP00000230882,9606.ENSP00000483403,9606,Homo sapiens,GHR,"Growth hormone-binding protein; Receptor for pituitary gland growth hormone involved in regulating postnatal body growth. On ligand binding, couples to the JAK2/STAT5 pathway (By similarity). Isoform 2 up-regulates the production of GHBP and acts as a negative inhibitor of GH signaling.",P10912
1201,ENSP00000222139,9606.ENSP00000222139,9606,Homo sapiens,EPOR,"Erythropoietin receptor; Receptor for erythropoietin. Mediates erythropoietin-induced erythroblast proliferation and differentiation. Upon EPO stimulation, EPOR dimerizes triggering the JAK2/STAT5 signaling cascade. In some cell types, can also activate STAT1 and STAT3. May also activate the LYN tyrosine kinase.",P19235
1202,ENSP00000227752,9606.ENSP00000227752,9606,Homo sapiens,IL10RA,"Interleukin-10 receptor subunit alpha; Cell surface receptor for the cytokine IL10 that participates in IL10-mediated anti-inflammatory functions, limiting excessive tissue disruption caused by inflammation. Upon binding to IL10, induces a conformational change in IL10RB, allowing IL10RB to bind IL10 as well. In turn, the heterotetrameric assembly complex, composed of two subunits of IL10RA and IL10RB, activates the kinases JAK1 and TYK2 that are constitutively associated with IL10RA and IL10RB respectively. These kinases then phosphorylate specific tyrosine residues in the intracellul [...] ",Q13651
1203,ENSP00000256452,9606.ENSP00000412209,9606,Homo sapiens,IL5RA,Interleukin-5 receptor subunit alpha; This is the receptor for interleukin-5. The alpha chain binds to IL5; Belongs to the type I cytokine receptor family. Type 5 subfamily.,Q01344
1204,ENSP00000242338,9606.ENSP00000368265,9606,Homo sapiens,CNTFR,Ciliary neurotrophic factor receptor subunit alpha; Binds to CNTF. The alpha subunit provides the receptor specificity. Receptor for heterodimeric neurotropic cytokine composed of CLCF1/CLC and CRLF1/CLF-1. Belongs to the type I cytokine receptor family. Type 3 subfamily.,P26992
1205,ENSP00000243213,9606.ENSP00000361004,9606,Homo sapiens,IL13RA2,"Interleukin-13 receptor subunit alpha-2; Binds as a monomer with high affinity to interleukin-13 (IL13), but not to interleukin-4 (IL4).",Q14627
1206,ENSP00000244174,9606.ENSP00000244174,9606,Homo sapiens,IL9R,Interleukin-9 receptor; This is a receptor for interleukin-9; Belongs to the type I cytokine receptor family. Type 4 subfamily.,Q01113
