queryIndex,queryItem,stringId,ncbiTaxonId,taxonName,preferredName,annotation,uniprot_accession
324,ENSP00000225792,9606.ENSP00000225792,9606,Homo sapiens,DDX5,Probable ATP-dependent RNA helicase DDX5; Involved in the alternative regulation of pre-mRNA splicing; its RNA helicase activity is necessary for increasing tau exon 10 inclusion and occurs in a RBM4-dependent manner. Binds to the tau pre- mRNA in the stem-loop region downstream of exon 10. The rate of ATP hydrolysis is highly stimulated by single-stranded RNA. Involved in transcriptional regulation; the function is independent of the RNA helicase activity. Transcriptional coactivator for androgen receptor AR but probably not ESR1. Synergizes with DDX17 and SRA1 RNA to activate MYOD1 t [...] ,P17844
325,ENSP00000242776,9606.ENSP00000242776,9606,Homo sapiens,DDX39A,ATP-dependent RNA helicase DDX39A; [Isoform 1]: Involved in pre-mRNA splicing. Required for the export of mRNA out of the nucleus; Belongs to the DEAD box helicase family. DECD subfamily.,O00148
326,ENSP00000257177,9606.ENSP00000257177,9606,Homo sapiens,TUT4,"Terminal uridylyltransferase 4; Uridylyltransferase that mediates the terminal uridylation of mRNAs with short (less than 25 nucleotides) poly(A) tails, hence facilitating global mRNA decay. Essential for both oocyte maturation and fertility. Through 3' terminal uridylation of mRNA, sculpts, with TUT7, the maternal transcriptome by eliminating transcripts during oocyte growth (By similarity). Involved in microRNA (miRNA)-induced gene silencing through uridylation of deadenylated miRNA targets. Also functions as an integral regulator of microRNA biogenesis using 3 different uridylation  [...] ",Q5TAX3
327,ENSP00000007722,9606.ENSP00000315190,9606,Homo sapiens,ITGA3,"Integrin alpha-3 heavy chain; Integrin alpha-3/beta-1 is a receptor for fibronectin, laminin, collagen, epiligrin, thrombospondin and CSPG4. Integrin alpha- 3/beta-1 provides a docking site for FAP (seprase) at invadopodia plasma membranes in a collagen-dependent manner and hence may participate in the adhesion, formation of invadopodia and matrix degradation processes, promoting cell invasion. Alpha-3/beta-1 may mediate with LGALS3 the stimulation by CSPG4 of endothelial cells migration.",P26006
328,ENSP00000222573,9606.ENSP00000222573,9606,Homo sapiens,ITGB8,"Integrin beta-8; Integrin alpha-V:beta-8 (ITGAV:ITGB8) is a receptor for fibronectin. It recognizes the sequence R-G-D in its ligands. Integrin alpha-V:beta-6 (ITGAV:ITGB6) mediates R-G-D-dependent release of transforming growth factor beta-1 (TGF-beta-1) from regulatory Latency-associated peptide (LAP), thereby playing a key role in TGF-beta-1 activation on the surface of activated regulatory T-cells (Tregs) (Probable). Required during vasculogenesis (By similarity).",P26012
329,ENSP00000009180,9606.ENSP00000371958,9606,Homo sapiens,CD9,"CD9 antigen; Integral membrane protein associated with integrins, which regulates different processes, such as sperm-egg fusion, platelet activation and aggregation, and cell adhesion. Present at the cell surface of oocytes and plays a key role in sperm-egg fusion, possibly by organizing multiprotein complexes and the morphology of the membrane required for the fusion (By similarity). In myoblasts, associates with CD81 and PTGFRN and inhibits myotube fusion during muscle regeneration (By similarity). In macrophages, associates with CD81 and beta-1 and beta-2 integrins, and prevents mac [...] ",P21926
330,ENSP00000200181,9606.ENSP00000200181,9606,Homo sapiens,ITGB4,Integrin beta-4; Integrin alpha-6/beta-4 is a receptor for laminin. Plays a critical structural role in the hemidesmosome of epithelial cells. Is required for the regulation of keratinocyte polarity and motility. ITGA6:ITGB4 binds to NRG1 (via EGF domain) and this binding is essential for NRG1-ERBB signaling. ITGA6:ITGB4 binds to IGF1 and this binding is essential for IGF1 signaling. ITGA6:ITGB4 binds to IGF2 and this binding is essential for IGF2 signaling.,P16144
331,ENSP00000222271,9606.ENSP00000222271,9606,Homo sapiens,COMP,Cartilage oligomeric matrix protein; May play a role in the structural integrity of cartilage via its interaction with other extracellular matrix proteins such as the collagens and fibronectin. Can mediate the interaction of chondrocytes with the cartilage extracellular matrix through interaction with cell surface integrin receptors. Could play a role in the pathogenesis of osteoarthritis. Potent suppressor of apoptosis in both primary chondrocytes and transformed cells. Suppresses apoptosis by blocking the activation of caspase-3 and by inducing the IAP family of survival proteins (BI [...] ,P49747
332,ENSP00000205386,9606.ENSP00000373433,9606,Homo sapiens,LAMB4,"Laminin subunit beta-4; Binding to cells via a high affinity receptor, laminin is thought to mediate the attachment, migration and organization of cells into tissues during embryonic development by interacting with other extracellular matrix components.",A4D0S4
333,ENSP00000222399,9606.ENSP00000222399,9606,Homo sapiens,LAMB1,"Laminin subunit beta-1; Binding to cells via a high affinity receptor, laminin is thought to mediate the attachment, migration and organization of cells into tissues during embryonic development by interacting with other extracellular matrix components. Involved in the organization of the laminar architecture of cerebral cortex. It is probably required for the integrity of the basement membrane/glia limitans that serves as an anchor point for the endfeet of radial glial cells and as a physical barrier to migrating neurons. Radial glial cells play a central role in cerebral cortical dev [...] ",P07942
334,ENSP00000231228,9606.ENSP00000231228,9606,Homo sapiens,IL12B,"Interleukin-12 subunit beta; Cytokine that can act as a growth factor for activated T and NK cells, enhance the lytic activity of NK/lymphokine-activated killer cells, and stimulate the production of IFN-gamma by resting PBMC. Belongs to the IL-12B family.",P29460
335,ENSP00000225964,9606.ENSP00000225964,9606,Homo sapiens,COL1A1,Collagen alpha-1(I) chain; Type I collagen is a member of group I collagen (fibrillar forming collagen).,P02452
336,ENSP00000226284,9606.ENSP00000226284,9606,Homo sapiens,IBSP,Bone sialoprotein 2; Binds tightly to hydroxyapatite. Appears to form an integral part of the mineralized matrix. Probably important to cell-matrix interaction. Promotes Arg-Gly-Asp-dependent cell attachment.,P21815
337,ENSP00000230538,9606.ENSP00000230538,9606,Homo sapiens,LAMA4,"Laminin subunit alpha-4; Binding to cells via a high affinity receptor, laminin is thought to mediate the attachment, migration and organization of cells into tissues during embryonic development by interacting with other extracellular matrix components.",Q16363
338,ENSP00000228534,9606.ENSP00000228534,9606,Homo sapiens,IL23A,"Interleukin-23 subunit alpha; Associates with IL12B to form the IL-23 interleukin, a heterodimeric cytokine which functions in innate and adaptive immunity. IL-23 may constitute with IL-17 an acute response to infection in peripheral tissues. IL-23 binds to a heterodimeric receptor complex composed of IL12RB1 and IL23R, activates the Jak-Stat signaling cascade, stimulates memory rather than naive T-cells and promotes production of proinflammatory cytokines. IL-23 induces autoimmune inflammation and thus may be responsible for autoimmune inflammatory diseases and may be important for tu [...] ",Q9NPF7
339,ENSP00000245932,9606.ENSP00000245932,9606,Homo sapiens,VASP,"Vasodilator-stimulated phosphoprotein; Ena/VASP proteins are actin-associated proteins involved in a range of processes dependent on cytoskeleton remodeling and cell polarity such as axon guidance, lamellipodial and filopodial dynamics, platelet activation and cell migration. VASP promotes actin filament elongation. It protects the barbed end of growing actin filaments against capping and increases the rate of actin polymerization in the presence of capping protein. VASP stimulates actin filament elongation by promoting the transfer of profilin-bound actin monomers onto the barbed end  [...] ",P50552
340,ENSP00000233809,9606.ENSP00000233809,9606,Homo sapiens,IGFBP2,Insulin-like growth factor-binding protein 2; Inhibits IGF-mediated growth and developmental rates. IGF- binding proteins prolong the half-life of the IGFs and have been shown to either inhibit or stimulate the growth promoting effects of the IGFs on cell culture. They alter the interaction of IGFs with their cell surface receptors.,P18065
341,ENSP00000239462,9606.ENSP00000239462,9606,Homo sapiens,TNN,"Tenascin-N; Extracellular matrix protein that seems to be a ligand for ITGA8:ITGB1, ITGAV:ITGB1 and ITGA4:ITGB1 (By similarity). Involved in neurite outgrowth and cell migration in hippocampal explants (By similarity). During endochondral bone formation, inhibits proliferation and differentiation of proteoblasts mediated by canonical WNT signaling (By similarity). In tumors, stimulates angiogenesis by elongation, migration and sprouting of endothelial cells. Expressed in most mammary tumors, may facilitate tumorigenesis by supporting the migratory behavior of breast cancer cells. ECO:0 [...] ",Q9UQP3
342,ENSP00000252699,9606.ENSP00000252699,9606,Homo sapiens,ACTN4,Alpha-actinin-4; F-actin cross-linking protein which is thought to anchor actin to a variety of intracellular structures. This is a bundling protein (Probable). Probably involved in vesicular trafficking via its association with the CART complex. The CART complex is necessary for efficient transferrin receptor recycling but not for EGFR degradation. Involved in tight junction assembly in epithelial cells probably through interaction with MICALL2. Links MICALL2 to the actin cytoskeleton and recruits it to the tight junctions (By similarity). May also function as a transcriptional coacti [...] ,O43707
343,ENSP00000260356,9606.ENSP00000260356,9606,Homo sapiens,THBS1,"Thrombospondin-1; Adhesive glycoprotein that mediates cell-to-cell and cell-to- matrix interactions. Binds heparin. May play a role in dentinogenesis and/or maintenance of dentin and dental pulp (By similarity). Ligand for CD36 mediating antiangiogenic properties. Plays a role in ER stress response, via its interaction with the activating transcription factor 6 alpha (ATF6) which produces adaptive ER stress response factors (By similarity).",P07996
344,ENSP00000258341,9606.ENSP00000258341,9606,Homo sapiens,LAMC1,"Laminin subunit gamma-1; Binding to cells via a high affinity receptor, laminin is thought to mediate the attachment, migration and organization of cells into tissues during embryonic development by interacting with other extracellular matrix components.",P11047
345,ENSP00000258969,9606.ENSP00000258969,9606,Homo sapiens,CHAD,"Chondroadherin; Promotes attachment of chondrocytes, fibroblasts, and osteoblasts. This binding is mediated (at least for chondrocytes and fibroblasts) by the integrin alpha(2)beta(1). May play an important role in the regulation of chondrocyte growth and proliferation (By similarity); Belongs to the small leucine-rich proteoglycan (SLRP) family. SLRP class IV subfamily.",O15335
346,ENSP00000261023,9606.ENSP00000261023,9606,Homo sapiens,ITGAV,"Integrin alpha-V heavy chain; The alpha-V (ITGAV) integrins are receptors for vitronectin, cytotactin, fibronectin, fibrinogen, laminin, matrix metalloproteinase- 2, osteopontin, osteomodulin, prothrombin, thrombospondin and vWF. They recognize the sequence R-G-D in a wide array of ligands. ITGAV:ITGB3 binds to fractalkine (CX3CL1) and may act as its coreceptor in CX3CR1- dependent fractalkine signaling. ITGAV:ITGB3 binds to NRG1 (via EGF domain) and this binding is essential for NRG1-ERBB signaling. ITGAV:ITGB3 binds to FGF1 and this binding is essential for FGF1 signaling. ITGAV:ITGB [...] ",P06756
347,ENSP00000007969,9606.ENSP00000390932,9606,Homo sapiens,LRRC23,Leucine-rich repeat-containing protein 23; Leucine rich repeat containing 23.,Q53EV4
348,ENSP00000215793,9606.ENSP00000215793,9606,Homo sapiens,SF3A1,"Splicing factor 3A subunit 1; Involved in pre-mRNA splicing as a component of the splicing factor SF3A complex that contributes to the assembly of the 17S U2 snRNP, and the subsequent assembly of the pre-spliceosome 'E' complex and the pre-catalytic spliceosome 'A' complex. Involved in pre-mRNA splicing as a component of pre- catalytic spliceosome 'B' complexes.",Q15459
349,ENSP00000156471,9606.ENSP00000156471,9606,Homo sapiens,AQR,"RNA helicase aquarius; Involved in pre-mRNA splicing as component of the spliceosome. Intron-binding spliceosomal protein required to link pre-mRNA splicing and snoRNP (small nucleolar ribonucleoprotein) biogenesis. Plays a key role in position-dependent assembly of intron-encoded box C/D small snoRNP, splicing being required for snoRNP assembly. May act by helping the folding of the snoRNA sequence. Binds to intron of pre-mRNAs in a sequence-independent manner, contacting the region between snoRNA and the branchpoint of introns (40 nucleotides upstream of the branchpoint) during the l [...] ",O60306
350,ENSP00000173229,9606.ENSP00000173229,9606,Homo sapiens,NTN1,"Netrin-1; Netrins control guidance of CNS commissural axons and peripheral motor axons. Its association with either DCC or some UNC5 receptors will lead to axon attraction or repulsion, respectively. Binding to UNC5C might cause dissociation of UNC5C from polymerized TUBB3 in microtubules and thereby lead to increased microtubule dynamics and axon repulsion. Involved in dorsal root ganglion axon projection towards the spinal cord. It also serves as a survival factor via its association with its receptors which prevent the initiation of apoptosis. Involved in tumorigenesis by regulating [...] ",O95631
351,ENSP00000199814,9606.ENSP00000199814,9606,Homo sapiens,RBM22,Pre-mRNA-splicing factor RBM22; Required for pre-mRNA splicing as component of the activated spliceosome. Involved in the first step of pre-mRNA splicing. Binds directly to the internal stem- loop (ISL) domain of the U6 snRNA and to the pre-mRNA intron near the 5' splice site during the activation and catalytic phases of the spliceosome cycle. Involved in both translocations of the nuclear SLU7 to the cytoplasm and the cytosolic calcium-binding protein PDCD6 to the nucleus upon cellular stress responses. Belongs to the SLT11 family.,Q9NW64
352,ENSP00000222969,9606.ENSP00000386023,9606,Homo sapiens,BUD31,Protein BUD31 homolog; Involved in the pre-mRNA splicing process. May play a role as regulator of AR transcriptional activity; may increase AR transcriptional activity.,P41223
353,ENSP00000217133,9606.ENSP00000217133,9606,Homo sapiens,TUBB1,"Tubulin beta-1 chain; Tubulin is the major constituent of microtubules. It binds two moles of GTP, one at an exchangeable site on the beta chain and one at a non-exchangeable site on the alpha chain (By similarity). Belongs to the tubulin family.",Q9H4B7
354,ENSP00000217026,9606.ENSP00000217026,9606,Homo sapiens,MYBL2,"Myb-related protein B; Transcription factor involved in the regulation of cell survival, proliferation, and differentiation. Transactivates the expression of the CLU gene.",P10244
355,ENSP00000221494,9606.ENSP00000221494,9606,Homo sapiens,SF3A2,"Splicing factor 3A subunit 2; Involved in pre-mRNA splicing as a component of the splicing factor SF3A complex that contributes to the assembly of the 17S U2 snRNP, and the subsequent assembly of the pre-spliceosome 'E' complex and the pre-catalytic spliceosome 'A' complex. Involved in pre-mRNA splicing as a component of pre- catalytic spliceosome 'B' complexes, including the Bact complex. Interacts directly with the duplex formed by U2 snRNA and the intron. Belongs to the SF3A2 family.",Q15428
356,ENSP00000221232,9606.ENSP00000351159,9606,Homo sapiens,CNOT3,"CCR4-NOT transcription complex subunit 3; Component of the CCR4-NOT complex which is one of the major cellular mRNA deadenylases and is linked to various cellular processes including bulk mRNA degradation, miRNA-mediated repression, translational repression during translational initiation and general transcription regulation. Additional complex functions may be a consequence of its influence on mRNA expression. May be involved in metabolic regulation; may be involved in recruitment of the CCR4-NOT complex to deadenylation target mRNAs involved in energy metabolism. Involved in mitotic  [...] ",O75175
357,ENSP00000227524,9606.ENSP00000227524,9606,Homo sapiens,PRPF19,"Pre-mRNA-processing factor 19; Ubiquitin-protein ligase which is a core component of several complexes mainly involved pre-mRNA splicing and DNA repair. Required for pre-mRNA splicing as component of the spliceosome. Core component of the PRP19C/Prp19 complex/NTC/Nineteen complex which is part of the spliceosome and participates in its assembly, its remodeling and is required for its activity. During assembly of the spliceosome, mediates 'Lys-63'-linked polyubiquitination of the U4 spliceosomal protein PRPF3. Ubiquitination of PRPF3 allows its recognition by the U5 component PRPF8 and  [...] ",Q9UMS4
358,ENSP00000229195,9606.ENSP00000229195,9606,Homo sapiens,CNOT2,"CCR4-NOT transcription complex subunit 2; Component of the CCR4-NOT complex which is one of the major cellular mRNA deadenylases and is linked to various cellular processes including bulk mRNA degradation, miRNA-mediated repression, translational repression during translational initiation and general transcription regulation. Additional complex functions may be a consequence of its influence on mRNA expression. Required for the CCR4- NOT complex structural integrity. Can repress transcription and may link the CCR4-NOT complex to transcriptional regulation; the repressive function may s [...] ",Q9NZN8
359,ENSP00000236273,9606.ENSP00000236273,9606,Homo sapiens,SYF2,Pre-mRNA-splicing factor SYF2; Involved in pre-mRNA splicing as component of the spliceosome. Belongs to the SYF2 family.,O95926
360,ENSP00000244520,9606.ENSP00000244520,9606,Homo sapiens,SNRPC,"U1 small nuclear ribonucleoprotein C; Component of the spliceosomal U1 snRNP, which is essential for recognition of the pre-mRNA 5' splice-site and the subsequent assembly of the spliceosome. SNRPC/U1-C is directly involved in initial 5' splice-site recognition for both constitutive and regulated alternative splicing. The interaction with the 5' splice-site seems to precede base-pairing between the pre-mRNA and the U1 snRNA. Stimulates commitment or early (E) complex formation by stabilizing the base pairing of the 5' end of the U1 snRNA and the 5' splice-site region. Belongs to the U1 [...] ",P09234
361,ENSP00000243563,9606.ENSP00000243563,9606,Homo sapiens,SNRPA,"U1 small nuclear ribonucleoprotein A; Component of the spliceosomal U1 snRNP, which is essential for recognition of the pre-mRNA 5' splice-site and the subsequent assembly of the spliceosome. U1 snRNP is the first snRNP to interact with pre-mRNA. This interaction is required for the subsequent binding of U2 snRNP and the U4/U6/U5 tri-snRNP. SNRPA binds stem loop II of U1 snRNA. In a snRNP-free form (SF-A) may be involved in coupled pre-mRNA splicing and polyadenylation process. May bind preferentially to the 5'-UGCAC-3' motif on RNAs; Belongs to the RRM U1 A/B'' family.",P09012
362,ENSP00000246071,9606.ENSP00000246071,9606,Homo sapiens,SNRPB2,"U2 small nuclear ribonucleoprotein B'; Involved in pre-mRNA splicing as component of the spliceosome. Associated with sn-RNP U2, where it contributes to the binding of stem loop IV of U2 snRNA.",P08579
363,ENSP00000251413,9606.ENSP00000251413,9606,Homo sapiens,TUBG1,"Tubulin gamma-1 chain; Tubulin is the major constituent of microtubules. The gamma chain is found at microtubule organizing centers (MTOC) such as the spindle poles or the centrosome. Pericentriolar matrix component that regulates alpha/beta chain minus-end nucleation, centrosome duplication and spindle formation.",P23258
364,ENSP00000251412,9606.ENSP00000251412,9606,Homo sapiens,TUBG2,"Tubulin gamma-2 chain; Tubulin is the major constituent of microtubules. The gamma chain is found at microtubule organizing centers (MTOC) such as the spindle poles or the centrosome. Pericentriolar matrix component that regulates alpha/beta chain minus-end nucleation, centrosome duplication and spindle formation (By similarity).",Q9NRH3
365,ENSP00000261531,9606.ENSP00000451129,9606,Homo sapiens,SNW1,"SNW domain-containing protein 1; Involved in pre-mRNA splicing as component of the spliceosome. Is required in the specific splicing of CDKN1A pre-mRNA; the function probably involves the recruitment of U2AF2 to the mRNA. Is proposed to recruit PPIL1 to the spliceosome. May be involved in cyclin-D1/CCND1 mRNA stability through the SNARP complex which associates with both the 3'end of the CCND1 gene and its mRNA. Involved in transcriptional regulation. Modulates TGF-beta-mediated transcription via association with SMAD proteins, MYOD1-mediated transcription via association with PABPN1,  [...] ",Q13573
366,ENSP00000259818,9606.ENSP00000259818,9606,Homo sapiens,TUBB2B,"Tubulin beta-2B chain; Tubulin is the major constituent of microtubules. It binds two moles of GTP, one at an exchangeable site on the beta chain and one at a non- exchangeable site on the alpha chain (By similarity). Plays a critical role in proper axon guidance in both central and peripheral axon tracts. Implicated in neuronal migration. Belongs to the tubulin family.",Q9BVA1
367,ENSP00000008527,9606.ENSP00000008527,9606,Homo sapiens,CRY1,"Cryptochrome-1; Transcriptional repressor which forms a core component of the circadian clock. The circadian clock, an internal time-keeping system, regulates various physiological processes through the generation of approximately 24 hour circadian rhythms in gene expression, which are translated into rhythms in metabolism and behavior. It is derived from the Latin roots 'circa' (about) and 'diem' (day) and acts as an important regulator of a wide array of physiological functions including metabolism, sleep, body temperature, blood pressure, endocrine, immune, cardiovascular, and renal [...] ",Q16526
368,ENSP00000216639,9606.ENSP00000216639,9606,Homo sapiens,VRK1,"Serine/threonine-protein kinase VRK1; Serine/threonine kinase involved in Golgi disassembly during the cell cycle: following phosphorylation by PLK3 during mitosis, required to induce Golgi fragmentation. Acts by mediating phosphorylation of downstream target protein. Phosphorylates 'Thr-18' of p53/TP53 and may thereby prevent the interaction between p53/TP53 and MDM2. Phosphorylates casein and histone H3. Phosphorylates BANF1: disrupts its ability to bind DNA, reduces its binding to LEM domain- containing proteins and causes its relocalization from the nucleus to the cytoplasm. Phosph [...] ",Q99986
369,ENSP00000233057,9606.ENSP00000233057,9606,Homo sapiens,EIF2AK2,"Interferon-induced, double-stranded RNA-activated protein kinase; IFN-induced dsRNA-dependent serine/threonine-protein kinase which plays a key role in the innate immune response to viral infection and is also involved in the regulation of signal transduction, apoptosis, cell proliferation and differentiation. Exerts its antiviral activity on a wide range of DNA and RNA viruses including hepatitis C virus (HCV), hepatitis B virus (HBV), measles virus (MV) and herpes simplex virus 1 (HHV-1). Inhibits viral replication via phosphorylation of the alpha subunit of eukaryotic initiation fac [...] ",P19525
370,ENSP00000231509,9606.ENSP00000231509,9606,Homo sapiens,NR3C1,"Glucocorticoid receptor; Receptor for glucocorticoids (GC). Has a dual mode of action: as a transcription factor that binds to glucocorticoid response elements (GRE), both for nuclear and mitochondrial DNA, and as a modulator of other transcription factors. Affects inflammatory responses, cellular proliferation and differentiation in target tissues. Involved in chromatin remodeling. Plays a role in rapid mRNA degradation by binding to the 5' UTR of target mRNAs and interacting with PNRC2 in a ligand- dependent manner which recruits the RNA helicase UPF1 and the mRNA- decapping enzyme D [...] ",P04150
371,ENSP00000257555,9606.ENSP00000438804,9606,Homo sapiens,HNF1A,"Hepatocyte nuclear factor 1-alpha; Transcriptional activator that regulates the tissue specific expression of multiple genes, especially in pancreatic islet cells and in liver (By similarity). Binds to the inverted palindrome 5'- GTTAATNATTAAC-3'. Activates the transcription of CYP1A2, CYP2E1 and CYP3A11 (By similarity).",P20823
372,ENSP00000254657,9606.ENSP00000254657,9606,Homo sapiens,PER2,"Period circadian protein homolog 2; Transcriptional repressor which forms a core component of the circadian clock. The circadian clock, an internal time-keeping system, regulates various physiological processes through the generation of approximately 24 hour circadian rhythms in gene expression, which are translated into rhythms in metabolism and behavior. It is derived from the Latin roots 'circa' (about) and 'diem' (day) and acts as an important regulator of a wide array of physiological functions including metabolism, sleep, body temperature, blood pressure, endocrine, immune, cardi [...] ",O15055
373,ENSP00000259750,9606.ENSP00000259750,9606,Homo sapiens,TTBK1,"Tau-tubulin kinase 1; Serine/threonine kinase which is able to phosphorylate TAU on serine, threonine and tyrosine residues. Induces aggregation of TAU.",Q5TCY1
