queryIndex,queryItem,stringId,ncbiTaxonId,taxonName,preferredName,annotation,uniprot_accession
0,ENSP00000000233,9606.ENSP00000000233,9606,Homo sapiens,ARF5,ADP-ribosylation factor 5; GTP-binding protein involved in protein trafficking; may modulate vesicle budding and uncoating within the Golgi apparatus. Belongs to the small GTPase superfamily. Arf family.,P84085
1,ENSP00000250971,9606.ENSP00000380432,9606,Homo sapiens,INS,"Insulin A chain; Insulin decreases blood glucose concentration. It increases cell permeability to monosaccharides, amino acids and fatty acids. It accelerates glycolysis, the pentose phosphate cycle, and glycogen synthesis in liver.",P01308
2,ENSP00000019317,9606.ENSP00000372924,9606,Homo sapiens,RALBP1,"RalA-binding protein 1; Can activate specifically hydrolysis of GTP bound to RAC1 and CDC42, but not RALA. Mediates ATP-dependent transport of S-(2,4- dinitrophenyl)-glutathione (DNP-SG) and doxorubicin (DOX) and is the major ATP-dependent transporter of glutathione conjugates of electrophiles (GS-E) and DOX in erythrocytes. Can catalyze transport of glutathione conjugates and xenobiotics, and may contribute to the multidrug resistance phenomenon. Serves as a scaffold protein that brings together proteins forming an endocytotic complex during interphase and also with CDK1 to switch off [...] ",Q15311
3,ENSP00000216373,9606.ENSP00000216373,9606,Homo sapiens,SOS2,Son of sevenless homolog 2; Promotes the exchange of Ras-bound GDP by GTP.,Q07890
4,ENSP00000012443,9606.ENSP00000012443,9606,Homo sapiens,PPP5C,"Serine/threonine-protein phosphatase 5; Serine/threonine-protein phosphatase that dephosphorylates a myriad of proteins involved in different signaling pathways including the kinases CSNK1E, ASK1/MAP3K5, PRKDC and RAF1, the nuclear receptors NR3C1, PPARG, ESR1 and ESR2, SMAD proteins and TAU/MAPT. Implicated in wide ranging cellular processes, including apoptosis, differentiation, DNA damage response, cell survival, regulation of ion channels or circadian rhythms, in response to steroid and thyroid hormones, calcium, fatty acids, TGF-beta as well as oxidative and genotoxic stresses. Pa [...] ",P53041
5,ENSP00000005340,9606.ENSP00000005340,9606,Homo sapiens,DVL2,Segment polarity protein dishevelled homolog DVL-2; Plays a role in the signal transduction pathways mediated by multiple Wnt genes. Participates both in canonical and non-canonical Wnt signaling by binding to the cytoplasmic C-terminus of frizzled family members and transducing the Wnt signal to down-stream effectors. Promotes internalization and degradation of frizzled proteins upon Wnt signaling; Belongs to the DSH family.,O14641
6,ENSP00000211287,9606.ENSP00000211287,9606,Homo sapiens,MAPK13,"Mitogen-activated protein kinase 13; Serine/threonine kinase which acts as an essential component of the MAP kinase signal transduction pathway. MAPK13 is one of the four p38 MAPKs which play an important role in the cascades of cellular responses evoked by extracellular stimuli such as proinflammatory cytokines or physical stress leading to direct activation of transcription factors such as ELK1 and ATF2. Accordingly, p38 MAPKs phosphorylate a broad range of proteins and it has been estimated that they may have approximately 200 to 300 substrates each. MAPK13 is one of the less studie [...] ",O15264
7,ENSP00000178640,9606.ENSP00000178640,9606,Homo sapiens,MAP2K5,"Dual specificity mitogen-activated protein kinase kinase 5; Acts as a scaffold for the formation of a ternary MAP3K2/MAP3K3-MAP3K5-MAPK7 signaling complex. Activation of this pathway appears to play a critical role in protecting cells from stress-induced apoptosis, neuronal survival and cardiac development and angiogenesis.",Q13163
8,ENSP00000020673,9606.ENSP00000384830,9606,Homo sapiens,PSD,PH and SEC7 domain-containing protein 1; Guanine nucleotide exchange factor for ARF6. Induces cytoskeletal remodeling (By similarity). Belongs to the PSD family.,A5PKW4
9,ENSP00000078429,9606.ENSP00000078429,9606,Homo sapiens,GNA11,Guanine nucleotide-binding protein subunit alpha-11; Guanine nucleotide-binding proteins (G proteins) are involved as modulators or transducers in various transmembrane signaling systems. Acts as an activator of phospholipase C.,P29992
10,ENSP00000202677,9606.ENSP00000202677,9606,Homo sapiens,RALGAPA2,Ral GTPase-activating protein subunit alpha-2; Catalytic subunit of the heterodimeric RalGAP2 complex which acts as a GTPase activator for the Ras-like small GTPases RALA and RALB.,Q2PPJ7
11,ENSP00000215659,9606.ENSP00000215659,9606,Homo sapiens,MAPK12,"Mitogen-activated protein kinase 12; Serine/threonine kinase which acts as an essential component of the MAP kinase signal transduction pathway. MAPK12 is one of the four p38 MAPKs which play an important role in the cascades of cellular responses evoked by extracellular stimuli such as proinflammatory cytokines or physical stress leading to direct activation of transcription factors such as ELK1 and ATF2. Accordingly, p38 MAPKs phosphorylate a broad range of proteins and it has been estimated that they may have approximately 200 to 300 substrates each. Some of the targets are downstre [...] ",P53778
12,ENSP00000215832,9606.ENSP00000215832,9606,Homo sapiens,MAPK1,"Mitogen-activated protein kinase 1; Serine/threonine kinase which acts as an essential component of the MAP kinase signal transduction pathway. MAPK1/ERK2 and MAPK3/ERK1 are the 2 MAPKs which play an important role in the MAPK/ERK cascade. They participate also in a signaling cascade initiated by activated KIT and KITLG/SCF. Depending on the cellular context, the MAPK/ERK cascade mediates diverse biological functions such as cell growth, adhesion, survival and differentiation through the regulation of transcription, translation, cytoskeletal rearrangements. The MAPK/ERK cascade plays a [...] ",P28482
13,ENSP00000230449,9606.ENSP00000230449,9606,Homo sapiens,EXOC2,Exocyst complex component 2; Component of the exocyst complex involved in the docking of exocytic vesicles with fusion sites on the plasma membrane; Belongs to the SEC5 family.,Q96KP1
14,ENSP00000223369,9606.ENSP00000223369,9606,Homo sapiens,YKT6,"Synaptobrevin homolog YKT6; Vesicular soluble NSF attachment protein receptor (v-SNARE) mediating vesicle docking and fusion to a specific acceptor cellular compartment. Functions in endoplasmic reticulum to Golgi transport; as part of a SNARE complex composed of GOSR1, GOSR2 and STX5. Functions in early/recycling endosome to TGN transport; as part of a SNARE complex composed of BET1L, GOSR1 and STX5. Has a S-palmitoyl transferase activity.",O15498
15,ENSP00000219476,9606.ENSP00000219476,9606,Homo sapiens,TSC2,"Tuberin; In complex with TSC1, this tumor suppressor inhibits the nutrient-mediated or growth factor-stimulated phosphorylation of S6K1 and EIF4EBP1 by negatively regulating mTORC1 signaling. Acts as a GTPase-activating protein (GAP) for the small GTPase RHEB, a direct activator of the protein kinase activity of mTORC1. May also play a role in microtubule-mediated protein transport (By similarity). Also stimulates the intrinsic GTPase activity of the Ras-related proteins RAP1A and RAB5 (By similarity).",P49815
16,ENSP00000219255,9606.ENSP00000219255,9606,Homo sapiens,PARD6A,"Partitioning defective 6 homolog alpha; Adapter protein involved in asymmetrical cell division and cell polarization processes. Probably involved in the formation of epithelial tight junctions. Association with PARD3 may prevent the interaction of PARD3 with F11R/JAM1, thereby preventing tight junction assembly. The PARD6-PARD3 complex links GTP-bound Rho small GTPases to atypical protein kinase C proteins. Regulates centrosome organization and function. Essential for the centrosomal recruitment of key proteins that control centrosomal microtubule organization ; Belongs to the PAR6 family.",Q9NPB6
17,ENSP00000219409,9606.ENSP00000219409,9606,Homo sapiens,ARHGDIG,"Rho GDP-dissociation inhibitor 3; Inhibits GDP/GTP exchange reaction of RhoB. Interacts specifically with the GDP- and GTP-bound forms of post-translationally processed Rhob and Rhog proteins, both of which show a growth-regulated expression in mammalian cells. Stimulates the release of the GDP-bound but not the GTP-bound RhoB protein. Also inhibits the GDP/GTP exchange of RhoB but shows less ability to inhibit the dissociation of prebound GTP.",Q99819
18,ENSP00000222547,9606.ENSP00000222547,9606,Homo sapiens,BET1,BET1 homolog; Required for vesicular transport from the ER to the Golgi complex. Functions as a SNARE involved in the docking process of ER- derived vesicles with the cis-Golgi membrane (By similarity).,O15155
19,ENSP00000221138,9606.ENSP00000221138,9606,Homo sapiens,PPP2CB,"Serine/threonine-protein phosphatase 2A catalytic subunit beta isoform; PP2A can modulate the activity of phosphorylase B kinase casein kinase 2, mitogen-stimulated S6 kinase, and MAP-2 kinase. Belongs to the PPP phosphatase family. PP-1 subfamily.",P62714
20,ENSP00000222345,9606.ENSP00000222345,9606,Homo sapiens,SIPA1L3,"Signal-induced proliferation-associated 1-like protein 3; Plays a critical role in epithelial cell morphogenesis, polarity, adhesion and cytoskeletal organization in the lens.",O60292
21,ENSP00000229794,9606.ENSP00000229795,9606,Homo sapiens,MAPK14,"Mitogen-activated protein kinase 14; Serine/threonine kinase which acts as an essential component of the MAP kinase signal transduction pathway. MAPK14 is one of the four p38 MAPKs which play an important role in the cascades of cellular responses evoked by extracellular stimuli such as proinflammatory cytokines or physical stress leading to direct activation of transcription factors. Accordingly, p38 MAPKs phosphorylate a broad range of proteins and it has been estimated that they may have approximately 200 to 300 substrates each. Some of the targets are downstream kinases which are a [...] ",Q16539
22,ENSP00000228307,9606.ENSP00000267257,9606,Homo sapiens,PXN,Paxillin; Cytoskeletal protein involved in actin-membrane attachment at sites of cell adhesion to the extracellular matrix (focal adhesion); Belongs to the paxillin family.,P49023
23,ENSP00000225567,9606.ENSP00000461784,9606,Homo sapiens,GOSR2,Golgi SNAP receptor complex member 2; Involved in transport of proteins from the cis/medial-Golgi to the trans-Golgi network; Belongs to the GOSR2 family.,O14653
24,ENSP00000229264,9606.ENSP00000229264,9606,Homo sapiens,GNB3,"Guanine nucleotide-binding protein G(I)/G(S)/G(T) subunit beta-3; Guanine nucleotide-binding proteins (G proteins) are involved as a modulator or transducer in various transmembrane signaling systems. The beta and gamma chains are required for the GTPase activity, for replacement of GDP by GTP, and for G protein-effector interaction.",P16520
25,ENSP00000228945,9606.ENSP00000228945,9606,Homo sapiens,ARHGDIB,"Rho GDP-dissociation inhibitor 2; Regulates the GDP/GTP exchange reaction of the Rho proteins by inhibiting the dissociation of GDP from them, and the subsequent binding of GTP to them. Regulates reorganization of the actin cytoskeleton mediated by Rho family members.",P52566
26,ENSP00000229812,9606.ENSP00000229812,9606,Homo sapiens,STK38,Serine/threonine-protein kinase 38; Negative regulator of MAP3K1/2 signaling. Converts MAP3K2 from its phosphorylated form to its non-phosphorylated form and inhibits autophosphorylation of MAP3K2.,Q15208
27,ENSP00000248901,9606.ENSP00000248901,9606,Homo sapiens,CYTH4,Cytohesin-4; Promotes guanine-nucleotide exchange on ARF1 and ARF5. Promotes the activation of ARF factors through replacement of GDP with GTP.,Q9UIA0
28,ENSP00000238081,9606.ENSP00000371267,9606,Homo sapiens,YWHAQ,"14-3-3 protein theta; Adapter protein implicated in the regulation of a large spectrum of both general and specialized signaling pathways. Binds to a large number of partners, usually by recognition of a phosphoserine or phosphothreonine motif. Binding generally results in the modulation of the activity of the binding partner. Negatively regulates the kinase activity of PDPK1; Belongs to the 14-3-3 family.",P27348
29,ENSP00000232461,9606.ENSP00000232461,9606,Homo sapiens,GNAT1,"Guanine nucleotide-binding protein G(t) subunit alpha-1; Functions as signal transducer for the rod photoreceptor RHO. Required for normal RHO-mediated light perception by the retina. Guanine nucleotide-binding proteins (G proteins) function as transducers downstream of G protein-coupled receptors (GPCRs), such as the photoreceptor RHO. The alpha chain contains the guanine nucleotide binding site and alternates between an active, GTP- bound state and an inactive, GDP-bound state. Activated RHO promotes GDP release and GTP binding. Signaling is mediated via downstream effector proteins, [...] ",P11488
30,ENSP00000232564,9606.ENSP00000232564,9606,Homo sapiens,GNB4,"Guanine nucleotide-binding protein subunit beta-4; Guanine nucleotide-binding proteins (G proteins) are involved as a modulator or transducer in various transmembrane signaling systems. The beta and gamma chains are required for the GTPase activity, for replacement of GDP by GTP, and for G protein-effector interaction.",Q9HAV0
31,ENSP00000240139,9606.ENSP00000380878,9606,Homo sapiens,PPP3CC,"Serine/threonine-protein phosphatase 2B catalytic subunit gamma isoform; Calcium-dependent, calmodulin-stimulated protein phosphatase which plays an essential role in the transduction of intracellular Ca(2+)-mediated signals. Dephosphorylates and activates transcription factor NFATC1. Dephosphorylates and inactivates transcription factor ELK1. Dephosphorylates DARPP32; Belongs to the PPP phosphatase family. PP-2B subfamily.",P48454
32,ENSP00000245796,9606.ENSP00000245796,9606,Homo sapiens,PSD4,"PH and SEC7 domain-containing protein 4; Guanine nucleotide exchange factor for ARF6 and ARL14/ARF7. Through ARL14 activation, controls the movement of MHC class II- containing vesicles along the actin cytoskeleton in dendritic cells. Involved in membrane recycling. Interacts with several phosphatidylinositol phosphate species, including phosphatidylinositol 3,4-bisphosphate, phosphatidylinositol 3,5-bisphosphate and phosphatidylinositol 4,5-bisphosphate.",Q8NDX1
33,ENSP00000245787,9606.ENSP00000245787,9606,Homo sapiens,INSIG2,Insulin-induced gene 2 protein; Mediates feedback control of cholesterol synthesis by controlling SCAP and HMGCR. Functions by blocking the processing of sterol regulatory element-binding proteins (SREBPs). Capable of retaining the SCAP-SREBF2 complex in the ER thus preventing it from escorting SREBPs to the Golgi. Seems to regulate the ubiquitin-mediated proteasomal degradation of HMGCR.,Q9Y5U4
34,ENSP00000248975,9606.ENSP00000248975,9606,Homo sapiens,YWHAH,"14-3-3 protein eta; Adapter protein implicated in the regulation of a large spectrum of both general and specialized signaling pathways. Binds to a large number of partners, usually by recognition of a phosphoserine or phosphothreonine motif. Binding generally results in the modulation of the activity of the binding partner. Negatively regulates the kinase activity of PDPK1.",Q04917
35,ENSP00000249923,9606.ENSP00000249923,9606,Homo sapiens,COPB1,"Coatomer subunit beta; The coatomer is a cytosolic protein complex that binds to dilysine motifs and reversibly associates with Golgi non-clathrin- coated vesicles, which further mediate biosynthetic protein transport from the ER, via the Golgi up to the trans Golgi network. Coatomer complex is required for budding from Golgi membranes, and is essential for the retrograde Golgi-to-ER transport of dilysine-tagged proteins. In mammals, the coatomer can only be recruited by membranes associated to ADP-ribosylation factors (ARFs), which are small GTP-binding proteins; the complex also infl [...] ",P53618
36,ENSP00000250244,9606.ENSP00000465685,9606,Homo sapiens,AP1M2,AP-1 complex subunit mu-2; Subunit of clathrin-associated adaptor protein complex 1 that plays a role in protein sorting in the trans-Golgi network (TGN) and endosomes. The AP complexes mediate the recruitment of clathrin to membranes and the recognition of sorting signals within the cytosolic tails of transmembrane cargo molecules.,Q9Y6Q5
37,ENSP00000254878,9606.ENSP00000254878,9606,Homo sapiens,RIDA,"2-iminobutanoate/2-iminopropanoate deaminase; Catalyzes the hydrolytic deamination of enamine/imine intermediates that form during the course of normal metabolism. May facilitate the release of ammonia from these potentially toxic reactive metabolites, reducing their impact on cellular components. It may act on enamine/imine intermediates formed by several types of pyridoxal-5'- phosphate-dependent dehydratases including L-threonine dehydratase. Belongs to the RutC family.",P52758
38,ENSP00000251849,9606.ENSP00000401888,9606,Homo sapiens,RAF1,"RAF proto-oncogene serine/threonine-protein kinase; Serine/threonine-protein kinase that acts as a regulatory link between the membrane-associated Ras GTPases and the MAPK/ERK cascade, and this critical regulatory link functions as a switch determining cell fate decisions including proliferation, differentiation, apoptosis, survival and oncogenic transformation. RAF1 activation initiates a mitogen-activated protein kinase (MAPK) cascade that comprises a sequential phosphorylation of the dual-specific MAPK kinases (MAP2K1/MEK1 and MAP2K2/MEK2) and the extracellular signal- regulated kin [...] ",P04049
39,ENSP00000260404,9606.ENSP00000453858,9606,Homo sapiens,PAK6,Serine/threonine-protein kinase PAK 6; Serine/threonine protein kinase that plays a role in the regulation of gene transcription. The kinase activity is induced by various effectors including AR or MAP2K6/MAPKK6. Phosphorylates the DNA-binding domain of androgen receptor/AR and thereby inhibits AR- mediated transcription. Inhibits also ESR1-mediated transcription. May play a role in cytoskeleton regulation by interacting with IQGAP1. May protect cells from apoptosis through phosphorylation of BAD.,Q9NQU5
40,ENSP00000253339,9606.ENSP00000437550,9606,Homo sapiens,LATS1,"Serine/threonine-protein kinase LATS1; Negative regulator of YAP1 in the Hippo signaling pathway that plays a pivotal role in organ size control and tumor suppression by restricting proliferation and promoting apoptosis. The core of this pathway is composed of a kinase cascade wherein STK3/MST2 and STK4/MST1, in complex with its regulatory protein SAV1, phosphorylates and activates LATS1/2 in complex with its regulatory protein MOB1, which in turn phosphorylates and inactivates YAP1 oncoprotein and WWTR1/TAZ. Phosphorylation of YAP1 by LATS1 inhibits its translocation into the nucleus  [...] ",O95835
41,ENSP00000251337,9606.ENSP00000251337,9606,Homo sapiens,GNAT2,Guanine nucleotide-binding protein G(t) subunit alpha-2; Guanine nucleotide-binding proteins (G proteins) are involved as modulators or transducers in various transmembrane signaling systems. Transducin is an amplifier and one of the transducers of a visual impulse that performs the coupling between rhodopsin and cGMP- phosphodiesterase.,P19087
42,ENSP00000253401,9606.ENSP00000490940,9606,Homo sapiens,ARHGEF9,Rho guanine nucleotide exchange factor 9; Acts as guanine nucleotide exchange factor (GEF) for CDC42. Promotes formation of GPHN clusters (By similarity).,O43307
43,ENSP00000254695,9606.ENSP00000254695,9606,Homo sapiens,RAP1GAP2,"Rap1 GTPase-activating protein 2; GTPase activator for the nuclear Ras-related regulatory protein RAP-1A (KREV-1), converting it to the putatively inactive GDP- bound state.",Q684P5
44,ENSP00000254584,9606.ENSP00000484121,9606,Homo sapiens,ARFIP2,"Arfaptin-2; Plays a role in constitutive metalloproteinase (MMP) secretion from the trans Golgi network. May have important functions during vesicle biogenesis at certain cargo subdomains, which could be predominantly utilized by secreted MMPs, such as MMP7 and MMP2. Participates also in autophagy by regulating the starvation-depdendent trafficking of ATG9A vesicles which deliver the PI4-kinase to the autophagosome initiation site. In addition, plays a role in NF-kappa-B inhibition by interacting with IKBKB and IKBKG.",P53365
45,ENSP00000253754,9606.ENSP00000253754,9606,Homo sapiens,PDLIM4,"PDZ and LIM domain protein 4; [Isoform 1]: Suppresses SRC activation by recognizing and binding to active SRC and facilitating PTPN13-mediated dephosphorylation of SRC 'Tyr-419' leading to its inactivation. Inactivated SRC dissociates from this protein allowing the initiation of a new SRC inactivation cycle. Involved in reorganization of the actin cytoskeleton. In nonmuscle cells, binds to ACTN1 (alpha-actinin-1), increases the affinity of ACTN1 to F-actin (filamentous actin), and promotes formation of actin stress fibers. Involved in regulation of the synaptic AMPA receptor transport  [...] ",P50479
46,ENSP00000256682,9606.ENSP00000256682,9606,Homo sapiens,ARF3,"ADP-ribosylation factor 3; GTP-binding protein that functions as an allosteric activator of the cholera toxin catalytic subunit, an ADP-ribosyltransferase. Involved in protein trafficking; may modulate vesicle budding and uncoating within the Golgi apparatus; Belongs to the small GTPase superfamily. Arf family.",P61204
47,ENSP00000255194,9606.ENSP00000255194,9606,Homo sapiens,AP3B1,"AP-3 complex subunit beta-1; Subunit of non-clathrin- and clathrin-associated adaptor protein complex 3 (AP-3) that plays a role in protein sorting in the late-Golgi/trans-Golgi network (TGN) and/or endosomes. The AP complexes mediate both the recruitment of clathrin to membranes and the recognition of sorting signals within the cytosolic tails of transmembrane cargo molecules. AP-3 appears to be involved in the sorting of a subset of transmembrane proteins targeted to lysosomes and lysosome-related organelles. In concert with the BLOC-1 complex, AP-3 is required to target cargos into  [...] ",O00203
48,ENSP00000256658,9606.ENSP00000358582,9606,Homo sapiens,AP4B1,AP-4 complex subunit beta-1; Component of the adaptor protein complex 4 (AP-4). Adaptor protein complexes are vesicle coat components involved both in vesicle formation and cargo selection. They control the vesicular transport of proteins in different trafficking pathways. AP-4 forms a non clathrin-associated coat on vesicles departing the trans-Golgi network (TGN) and may be involved in the targeting of proteins from the trans-Golgi network (TGN) to the endosomal-lysosomal system. It is also involved in protein sorting to the basolateral membrane in epithelial cells and the proper asy [...] ,Q9Y6B7
49,ENSP00000258739,9606.ENSP00000258739,9606,Homo sapiens,KDELR2,"ER lumen protein-retaining receptor 2; Receptor for the C-terminal sequence motif K-D-E-L that is present on endoplasmic reticulum resident proteins and that mediates their recycling from the Golgi back to the endoplasmic reticulum. Binding is pH dependent, and is optimal at pH 5-5.4 (By similarity); Belongs to the ERD2 family.",P33947
50,ENSP00000262305,9606.ENSP00000262305,9606,Homo sapiens,RAB11FIP3,"Rab11 family-interacting protein 3; Acts as a regulator of endocytic traffic by participating in membrane delivery. Required for the abcission step in cytokinesis, possibly by acting as an 'address tag' delivering recycling endosome membranes to the cleavage furrow during late cytokinesis. Also required for the structural integrity of the endosomal recycling compartment during interphase. May play a role in breast cancer cell motility by regulating actin cytoskeleton. Acts as an adapter protein linking the dynein motor complex to various cargos and converts dynein from a non- processiv [...] ",O75154
51,ENSP00000261890,9606.ENSP00000261890,9606,Homo sapiens,RAB11A,"Ras-related protein Rab-11A; The small GTPases Rab are key regulators of intracellular membrane trafficking, from the formation of transport vesicles to their fusion with membranes. Rabs cycle between an inactive GDP-bound form and an active GTP-bound form that is able to recruit to membranes different set of downstream effectors directly responsible for vesicle formation, movement, tethering and fusion. The small Rab GTPase RAB11A regulates endocytic recycling. Acts as a major regulator of membrane delivery during cytokinesis. Together with MYO5B and RAB8A participates in epithelial c [...] ",P62491
52,ENSP00000261842,9606.ENSP00000261842,9606,Homo sapiens,AP4E1,AP-4 complex subunit epsilon-1; Component of the adaptor protein complex 4 (AP-4). Adaptor protein complexes are vesicle coat components involved both in vesicle formation and cargo selection. They control the vesicular transport of proteins in different trafficking pathways. AP-4 forms a non clathrin-associated coat on vesicles departing the trans-Golgi network (TGN) and may be involved in the targeting of proteins from the trans-Golgi network (TGN) to the endosomal-lysosomal system. It is also involved in protein sorting to the basolateral membrane in epithelial cells and the proper  [...] ,Q9UPM8
53,ENSP00000261558,9606.ENSP00000261558,9606,Homo sapiens,AP5M1,"AP-5 complex subunit mu-1; As part of AP-5, a probable fifth adaptor protein complex it may be involved in endosomal transport. According to it may play a role in cell death.",Q9H0R1
54,ENSP00000261845,9606.ENSP00000261845,9606,Homo sapiens,MAPK6,"Mitogen-activated protein kinase 6; Atypical MAPK protein. Phosphorylates microtubule-associated protein 2 (MAP2) and MAPKAPK5. The precise role of the complex formed with MAPKAPK5 is still unclear, but the complex follows a complex set of phosphorylation events: upon interaction with atypical MAPKAPK5, ERK3/MAPK6 is phosphorylated at Ser-189 and then mediates phosphorylation and activation of MAPKAPK5, which in turn phosphorylates ERK3/MAPK6. May promote entry in the cell cycle (By similarity); Belongs to the protein kinase superfamily. CMGC Ser/Thr protein kinase family. MAP kinase s [...] ",Q16659
